,asin,product_name,product_brand,product_rating,product_rate_count,category,description
0,B00HZDRCRO,0,0,0,0,0,0
1,B00RAXEM9K,SoundPal SonoBass Wireless Over-Ear Headphones PS4 Xbox Compatible,SoundPal,3.6 out of 5 stars,225 ratings,"['Electronics', 'Headphones', 'Over-Ear Headphones']","['Consumer Alert: Most users do not need a license to operate this wireless microphone system. Nevertheless, operating this microphone system without a license is subject to certain restrictions: the system may not cause harmful interference; it must operate at a low power level (not in excess of 50 milliwatts); and it has no protection from interference received from any other device.', ""Purchasers should also be aware that the FCC is currently evaluating use of wireless microphone systems, and these rules are subject to change. For more information, call the FCC at 1-888- CALL-FCC (TTY: 1-888-TELL-FCC) or visit the FCC's wireless microphone website at fcc.gov/cgb/wirelessmicrophones.""]"
2,B01BLZ8BA8,TV Remote Add-on for Fire TV Stick Remote (Control Your TV Directly from Your Fire TV Remote),Mission Cables,3.4 out of 5 stars,308 ratings,"['Electronics', 'Accessories & Supplies', 'Audio & Video Accessories', 'Remote Controls & Accessories', 'Remote Controls']","['Control your TV directly from your Fire TV Stick remote.', 'Avoid the hassle of managing two different remotes.', 'Easily snaps on to back of Fire TV Stick remote.', 'Compatible with Fire TV Stick Remote (See https://amzn.com/B01N32WC5H for the voice remote version)', 'Fire TV Remote not included, Patent Pending.']"
3,B00Q7V8NR8,iPad Air 2 A1567 Slim Tough Case G5 - Rugged Protection with Built-in Hard Cover and Stylus (Black),Hitek,3.4 out of 5 stars,13 ratings,"['Electronics', 'Computers & Accessories', 'Tablet Accessories', 'Bags, Cases & Sleeves', 'Keyboard Cases']","['Super rugged protection for the iPad Air 2 A1567', 'Hard cover eliminates broken screens', 'Built-in stylus for accurate navigation and keeps screen clean', 'Auto wake/sleep optimizes battery life', 'Built-in stand for presentation and typing']"
4,B00KCVZ2FA,"STK EN-EL15 EN-EL15a Battery for Nikon D7000, D7100, D7200, D850, D750, Nikon D7500 Battery, D810, D500, D800, D610, D600 Compatible Nikon EN-EL15b Battery",STK/SterlingTek,4.2 out of 5 stars,"1,004 ratings","['Electronics', 'Camera & Photo', 'Accessories', 'Batteries & Chargers', 'Batteries', 'Camera Batteries']","['Make sure this fits\nby entering your model number.', 'REPLACES - Nikon EN-EL15 battery, EN-EL15a battery, EN-EL15b battery Nikon D7000 Battery, Nikon D7100 battery, Nikon D7200, Nikon D850, Nikon D750, Nikon D7500 Battery, Nikon D810 Battery, Nikon D500 Battery, Nikon D800 Battery, Nikon D610 Battery, Nikon D600 Battery and more Compatible Nikon EN-EL15b battery and more', ""TOP QUALITY AT AN EXCELLENT PRICE - STK's Nikon EN-EL15 2200mAh Battery Replacement is made with Japanese Cells."", 'AS GOOD OR BETTER THAN THE ORIGINAL - STK EN-EL15 battery is equivalent to or Exceeds OEM Nikon ENEL15 Battery specs.', 'TESTED INDEPENDENTLY FOR SAFETY - CE and RoHS Safety Certification.', 'HAVE A PROBLEM, LET US KNOW We take care of our customers just email us.']"
5,B00Q8QKQ36,Power Supply+Cord for Toshiba Satellite 1130 1135-S155 A300 A305 A305-S6872 L750D P205-S6267 P205-S6307 P205-S7469 P775-S7100 P855-S5200 P875 P875-S7102 P875-S7310 S55-A5295 S855-S5290P S855-S5378,Unknown,4.2 out of 5 stars,19 ratings,"['Electronics', 'Computers & Accessories', 'Laptop Accessories', 'Chargers & Adapters']","['Make sure this fits\nby entering your model number.', 'Input : 100-240V ~ 1.2A 50/60Hz - Output : DC 19V, 3.95A, 75W', 'This Product has 12 MONTHS REPLACEMENT WARRANTY', '100% OEM compatible', 'CONDITION AND PACKAGE CONTENTS: BRAND NEW One Pc Laptop AC Adapter for listed models']"
6,B00TU7U4PU,"Acer Chromebook 15 CB5-571-C1DZ (15.6-Inch Full HD IPS, 4GB RAM, 16GB SSD)",Acer,3.9 out of 5 stars,606 ratings,"['Electronics', 'Computers & Accessories', 'Computers & Tablets', 'Laptops', 'Traditional Laptops']","['No deductibles or added costs. Parts, labor and shipping included.', ""Drops, spills and cracked screens covered from day one. Other breakdowns covered after the manufacturer's warranty expires."", 'Includes 24/7 tech support - setup, connectivity issues, troubleshooting and much more.', ""File a claim online or by phone 24/7. If we can't repair it, we'll replace it or reimburse the purchase price with an Amazon e-gift card."", 'Plans are only valid for new or certified refurbished products purchased in the last 30 days with no pre-existing damage. Protection plan documents will be delivered via email within 24 hours of purchase.']"
7,B01CQC85JW,"SUPCASE [Unicorn Beetle Pro Series] Case Designed for iPad Pro 9.7 inch, with Built-In Screen Protector [Heavy Duty] Full-body Rugged Protective Dual Layer Case for iPad Pro 9.7 2016 (Black/Black)",SupCase,4.0 out of 5 stars,616 ratings,"['Electronics', 'Computers & Accessories', 'Tablet Accessories', 'Bags, Cases & Sleeves', 'Cases']","['Impact Resistant, Full Body Case for Apple iPad Pro 2016 A1673/A1674/A1675 (9.7 inch)', 'Shock resistant, Dual layer case with PC Hard shell and flexible TPU provides protection against accidental drops, Bumps and shock', 'Front cover with Built-in screen protector prevents Scratches without compromising sensitivity and port covers and dust Ports block against unwanted dust and debris', 'Functional Pop out kickstand allows Easy access to your favorite shows, movies, and games while on the go', 'Precise cut and design allow easy access to all ports, sensors, speakers, cameras and all Apple iPad Pro 2016 A1673/A1674/A1675 features']"
8,B016AQXG80,Beltronics RX65 Red Professional Series Radar/Laser Detector with Accessories Bundle (Blue),Beltronics,4.2 out of 5 stars,49 ratings,"['Electronics', 'Car & Vehicle Electronics', 'Vehicle Electronics Accessories', 'Radar Detectors']","['BELTRONICS AUTHORIZED DEALER With FULL Warranty', 'INCLUDES BONUS RadarMount Car Mirror Mount Bracket For Radar Detectors - Escort/Beltronics (3001001), RadarMount Radar Detector Direct Wire Power Cord - (3005002) - Cobra, Whistler', ""ALSO INCLUDES Comprehensive Owner's Manual, Quick-release Windshield Mount, Coiled SmartPlug, Quick Reference Card, Convenient Travel Case"", 'FULL X, K, SuperWide Ka, and Safety Warning System radar capability, digital ""POP"" radar alert, and Safety Warning System message display. ADVANCED AUTOSCAN processing and digital signal processing increase range and virtually eliminate false alerts.', 'EASY-TO-USE programming allows you to customize up to 7 options for your specific driving style. IMMUNE TO VG-2 radar detector detection, so law enforcement cannot detect its use. ONE-YEAR limited warranty.']"
9,B00HPMCN8S,Sony KDL60W630B 60-Inch 1080p 120Hz Smart LED TV (2014 Model),Sony,3.7 out of 5 stars,200 ratings,"['Electronics', 'Television & Video', 'Televisions', 'LED & LCD TVs']","['Refresh Rate: 120Hz (Native)', 'Backlight: LED (Edge-Lit)', 'Smart Functionality: Yes - Skype, Twitter, Internet Browser (Opera)', 'Display Resolution: Full HD, Viewing Angle (Up/Down): 178(89/89) degree, Aspect Ratio: 16:9.', 'Inputs: 4 HDMI, 3 USB, MHL', 'Accessories Included: Remote Control, Table Top Stand']"
10,B00LA1G7DC,NZXT PHANTOM ATX Full Tower Case - White (PHAN-001WT),NZXT,4.3 out of 5 stars,316 ratings,"['Electronics', 'Computers & Accessories', 'Computer Components', 'External Components', 'Computer Cases']","['Make sure this fits\nby entering your model number.', 'High Performance Cooling Advantages', 'Simple Installation', 'Additional Advanced Features', 'Extensive Compatibility and Expandability']"
11,B01C4W2P18,(Old Model) Seagate 2TB Laptop HDD SATA 6Gb/s 128MB Cache 2.5-Inch Internal Hard Drive (ST2000LM015),Seagate,4.2 out of 5 stars,543 ratings,"['Electronics', 'Computers & Accessories', 'Data Storage', 'Internal Hard Drives']","['Make sure this fits\nby entering your model number.', ""Seagate's highest capacity, thin (7 millimeter) laptop drives at 1TB and 2TB; 5400rpm"", 'Light in weight to support portable computers', 'Enables drop in 2TB capacity transition without the weight of traditional laptop drives', 'Stores up to 200,000 photos, 250,000 songs or 124 hours of high definition video', 'Standard SATA 6Gb/s interface for easy integration into existing mobile/laptop designs']"
12,B00NF8812S,Rubber Coated Magnet Mount for GoPro HERO Cameras,RIDIC Accessories,4.7 out of 5 stars,39 ratings,"['Electronics', 'Camera & Photo', 'Accessories', 'Tripod & Monopod Accessories', 'Camera Mounts & Clamps']","['Make sure this fits\nby entering your model number.', 'Mount your GoPro to any magnetic surface', 'Rubber coating will protect mounting surface from damage', '40 pound pull force', '2.6” diameter x 0.3” thick with Aluminum alloy GoPro mount', 'Compatible with all GoPro HERO models']"
13,B013X0H4JI,"50 PCS Reusable Hook and Loop Fastening Cable Ties with Microfiber Cloth, 5 Color",H-Style,4.7 out of 5 stars,372 ratings,"['Electronics', 'Accessories & Supplies', 'Cord Management', 'Cable Ties']","['Make sure this fits\nby entering your model number.', 'Fabric material with attachments, reusable and durable', 'Extendable: Multiple ties can be attached together to form one longer tie.', 'Dimensions: 6 inch X 0.47 inch (150 x 12 mm).', 'Organize your wires and cables with reusable hook and loop fastening cable ties.', 'Assorted colors: 10pcs of each color: Blue Yellow Green Red Black.']"
14,B01584OQXE,Deyard Waterproof Housing Case for GoPro Hero 4 and Hero 3+ with Quick Release Mount and Thumbscrew for GoPro Hero 4 and Hero 3+ Action Camcorder - 45 Meters Underwater Photography,Deyard,4.3 out of 5 stars,264 ratings,"['Electronics', 'Camera & Photo', 'Underwater Photography', 'Housings']","['Make sure this fits\nby entering your model number.', '147ft/45M WATERPROOF DEPTH: With high strength shell, tight buckle and waterproof seal, this GoPro 4 case waterproof up to 147ft/45M, ideal for diving snorkeling and other underwater activities.', 'HD SCRATCH PROOF LENS, CLEAR SHOOTING UNDER WATER: With tempered glass lens, extra protection for your GoPro lens from being scratched while diving. HD lens with high transmittance makes this GoPro 4 waterproof case perfect for making a clear shooting under water', 'HIGH DEFINITION REAR COVER: Transparent rear cover with high transmittance of this GoPro 3 + waterproof case allows you to see high definition picture from GoPro under water', 'SUPERIOR SHOCKPROOF THICK SHELL: Well protect your GoPro action camera for extreme sport like surfing, diving, snorkeling, skiing, drifting, skydiving cycling etc.', 'COMPATIBLE SIZE : Compatible waterproof case for GoPro Hero 4 and Hero 3+ action camera, easily operate the shutter/power button or select key/ Mode button under water with external button.']"
15,B00SS3EWG4,iPearl mCover Hard Shell Case for 13-inch Model A1425 / A1502 MacBook Pro (with 13.3-inch Retina Display) - Frosted Clear,mCover,4.4 out of 5 stars,"1,138 ratings","['Electronics', 'Computers & Accessories', 'Laptop Accessories', 'Bags, Cases & Sleeves']","['Make sure this fits\nby entering your model number.', 'Made of USA-made high-quality DOW polycarbonate material, which is shatter-proof and will protect your 13.3"" A1425/A1502 MacBook Pro with Retina Display all around', 'Designed to perfectly fit the 13-inch MacBook pro with 13.3"" Retina Display model A1502 released in late 2013 (with part number ME864LL/A, ME865LL/A or ME866LL/A) and model A1425 released in October 2012 (with USB 3 ports and MagSafe 2 connector, with part number MD212LL/A or MD213LL/A)', 'NOT fit the 13-inch A1278 MacBook pro with regular display', 'Ergonomically designed retractable feet at the rear bottom let you type more comfortably in addition to better heat dissipation. All ports, battery test button and charging port are accessible', '2-piece light-weight (10 oz or 285g) shell easily snaps on and off']"
16,B00LAMSQ7Q,Lenovo ThinkPad T410 Laptop Notebook WEBCAM - Core i5 2.4ghz - 4GB DDR3 - 250GB HDD - DVD+CDRW - Windows 7,Lenovo,3.7 out of 5 stars,12 ratings,"['Electronics', 'Computers & Accessories', 'Computers & Tablets', 'Laptops', 'Traditional Laptops']","['Make sure this fits\nby entering your model number.', 'Core i5 2.4GHz', '4GB RAM / 250GB Hard Drive', 'DVD+CDRW', '14.1"" display / Webcam', 'Windows 7 Home Premium 64bit']"
17,B00OOPGAN8,Elegani Animal Print Dual Function Conductive Microfiber Fabric Capacitive Stylus Rollerball Ink Pen - Retail Packaging - Animal Print Giraffe Pink,ELEGANI,2.5 out of 5 stars,2 ratings,"['Electronics', 'Computers & Accessories', 'Tablet Accessories', 'Styluses']","['ELEGANI Dual function stylus pen ink pen combo is perfect for writting, drawing, gaming or any use where you need a finer degree of control than your finger cannot offer.', 'Dual Function Stylus Pen Ink Pen Duo is convenient 2-in-1 solution to create, draw, write and sketch ideas. The ultra responsive and high sensitive microfiber fabric touch tip of the stylus allows content to glide smoothly on touch screen devices.', ""This touch stylus is the prefect solution for people who want an effortless, precise and enjoyable experience with their smart phones PDA'S and tabets It's soft&smooth slicone tip glides with ease compared to rubber tip stylus."", 'Sketch, Type and Navigate applications on your devices/ Touch Stylus is perfect for writting, drawing, gaming or any use where you need a finer degree of control than your finger cannot offer', 'Ergonomic design with solid steel construction. Elegani Touch Screen Stylus Pen with Soft Nano Fabric, Micro-Fiber Tip Stylus & Ball Point Pen for Apple iPhone iPad Samsung HTC Blackberry Smartphone & Other Touch Screen Devices.']"
18,B00ET4KHJ2,Cable Matters USB to Ethernet Adapter (USB 2.0 to Ethernet / USB to RJ45) Supporting 10 / 100 Mbps Ethernet Network in Black,Cable Matters,4.3 out of 5 stars,"1,246 ratings","['Electronics', 'Computers & Accessories', 'Networking Products', 'Network Adapters']","['Make sure this fits\nby entering your model number.', 'ETHERNET TO USB ADAPTER connects a computer or Raspberry Pi 3 to a router, modem, or network switch for a Fast Ethernet (100 Mbps) network connection; Connect the USB Ethernet adapter to your laptop without an Ethernet port', 'COST-EFFECTIVE USB network adapter for many computer applications that only require a 100 Mbps Ethernet connection; Use this convenient USB Lan adapter to replace a failed USB NIC or Ethernet port on an older computer', 'PORTABLE ETHERNET USB ADAPTER weighs less than 1 ounce with a 6-inch cable tail to connect to your computer; Wired USB LAN adapter is more secure than most Wi-Fi connections', 'FEATURE-FILLED USB TO ETHERNET network adapter supports Wake-on-Lan (WoL), Full-Duplex (FDX) and Half-Duplex (HDX) Ethernet, Crossover Detection, Backpressure Routing, Auto-Correction (Auto MDIX); Supports IPv4/IPv6 protocols in 10BASE-T and 100BASE-TX networks', 'DRIVER-FREE SIMPLE INSTALLATION USB to RJ45 adapter for most computers; Diagnostic LEDs on this Ethernet USB adapter verify the power, connection and data transfer status; OS compatible Windows 10/8.1/8/7/Vista/XP, macOS 10.6 and up, Chrome OS and Linux for kernels up to 4.15; USB to RJ45 adapter is NOT compatible with Windows RT, or Android']"
19,B00GCDVNHI,Audioengine D3 Portable DAC & Headphone Amp,Audioengine,4.4 out of 5 stars,48 ratings,"['Electronics', 'Accessories & Supplies', 'Audio & Video Accessories', 'Headphone Accessories', 'Amps']","['No deductibles or added costs. Parts, labor and shipping included.', ""Power surge covered from day one. Other breakdowns covered after the manufacturer's warranty expires."", 'Includes 24/7 tech support - setup, connectivity issues, troubleshooting and much more.', ""File a claim online or by phone 24/7. If we can't repair it, we'll replace it or reimburse the purchase price with an Amazon e-gift card."", 'Plans are only valid for new or certified refurbished products purchased in the last 30 days with no pre-existing damage. Protection plan documents will be delivered via email within 24 hours of purchase.']"
20,B00HGJ7JMU,"CablesOnline DB9 Null Modem Male to Male Slimline Data Transfer Adapter/Gender Changer , (2-Pack) (AD-N05M-2)",CablesOnline,5.0 out of 5 stars,11 ratings,"['Electronics', 'Computers & Accessories', 'Computer Accessories & Peripherals', 'Cables & Interconnects']","['Make sure this fits\nby entering your model number.', '(1) DB9 Null Modem Male to (1) DB9 Null Modem Male Connector', 'Connect two DTE or DCE devices with no conflict in data transmission', 'Crossed receive and transmit conductors', 'Slim profile reduces bending and provides a secure connection ; Nickel plated construction with gold contacts', '2x Adapters included']"
21,B0125T5GLQ,"Beyution New Replaced Remote Fit for Roku 1 Lt, Hd ; Roku 2 Xd, Xs with Instant Replay -Function 100% Same As Original",Beyution,3.8 out of 5 stars,33 ratings,"['Electronics', 'Accessories & Supplies', 'Audio & Video Accessories', 'Remote Controls & Accessories', 'Remote Controls']","['Make sure this fits\nby entering your model number.', 'New Replaced Roku IR remote. this is not original, but functions is same as original remote', 'No need any program, only put into new battery can work well', 'USA Seller ,quick shipping!', '60 days warranty! USA Seller!', 'This is IR Remote, not Bluetooth or WIFI remote, please read your original manual before order.']"
22,B013UJAT58,"iPad Air 2 Case, Boriyuan Detachable 360 Degree Rotating Stand Flip Folio PU Leather Smart Cover with Auto Sleep / Wake Function + Card Slot + Screen Protector + Stylus For Apple iPad 6, Pink",Boriyuan,3.3 out of 5 stars,6 ratings,"['Electronics', 'Computers & Accessories', 'Tablet Accessories']","['Make sure this fits\nby entering your model number.', 'PU Leather Case - This case is made of high quality ultra slim lightweight PU leather material and brings your iPad a comprehensive protection, so it is easy to work, home or other place. ONLY for iPad Air 2 /iPad 6, NOT fit for any other iPad models.', 'Detachable 360 Degree Rotating Stand - With detachable 360 degree rotating kickstand, you will have a comfortable experience while you are watching movies or videos. When you use the iPad, it will be no slip ,falling down or other problems.', 'Auto Sleep / Wake Function - When open the smart cover, your iPad instantly wakes up; when close it, your iPad automatically goes to sleep. You can press any key to wake the keyboard up. It gives your iPad long life battery, and the battery can last up to many hours.', 'Smart Cover - This unique and ingenious design carefully covers every corner of the iPad ,without adding unnecessary scratches and fall. Flip folio design offers convenient mobility, so you can just grab your and be ready to go knowing it will be protected at all times. Easy access to all buttons, controls and ports without removing the case.', 'Warranty and Customer Service - At Boriyuan, you can find affordable, high-quality and 100% user satisfied Products. Any problem,don not hesitate to contact us. ★★★Boriyuan provides you with 24-hour email contact service & 2-year worry-free warranty & 30-day money-back guarantee.']"
23,B00ZSEFXM8,"AudioSource Analog Amplifier, Stereo Power A Amplifier AMP102VS for Home Sound Systems",Audiosource,4.2 out of 5 stars,154 ratings,"['Electronics', 'Home Audio', 'Home Theater', 'Receivers & Amplifiers', 'Amplifiers']","['No deductibles or added costs. Parts, labor and shipping included.', ""Power surge covered from day one. Other breakdowns covered after the manufacturer's warranty expires."", 'Includes 24/7 tech support - setup, connectivity issues, troubleshooting and much more.', ""File a claim online or by phone 24/7. If we can't repair it, we'll replace it or reimburse the purchase price with an Amazon e-gift card."", 'Plans are only valid for new or certified refurbished products purchased in the last 30 days with no pre-existing damage. Protection plan documents will be delivered via email within 24 hours of purchase.']"
24,B00MYBR75O,Samsung UN40H5003 40-Inch 1080p LED TV (2014 Model),Samsung,4.2 out of 5 stars,786 ratings,"['Electronics', 'Television & Video', 'Televisions', 'LED & LCD TVs']","['Refresh Rate: 60Hz (Native); 120 CMR (Effective)', 'Backlight: LED (Edge-Lit)', 'Smart Functionality: No', ""Dimensions (W x H x D): TV without stand: 36.1'' x 21'' x 3.7'', TV with stand: 36.1'' x 23.3'' x 9''"", 'Inputs: 2 HDMI, 1 USB, 1 Component In, 1 Composite In', 'Accessories Included: Standard Remote Control']"
25,B00JEL9F7K,Juiced Systems 13 Data Port + 1 Smart Charging 2.1 Amp Port Aluminum USB 3.0 Hub - 12V/5A Power Supply- VIA VL812-B2 Chipset,Juiced Systems,4 out of 5 stars,14 ratings,"['Electronics', 'Computers & Accessories', 'Networking Products', 'Hubs']","['Make sure this fits\nby entering your model number.', 'Ultrafast USB HUB - 13x USB 3.0 Ports (5gbps transfer speeds)', '1x Port 2.4 Amp Output (Charge Tablets at full Speed)', '12 Volt 5 Amp AC Power Supply', 'Standard USB 3.0 Ports Provide Aprox. 900mAH Per USB Port Output', 'The high quality materials and chipsets technologies designed within our hubs guarantees enhanced performance, reliability, and safety.']"
26,B01GW4JDMI,UBEE DDW36C CABLE MODEM WIRELESS ROUTER GATEWAY TWC ONLY,Ubee,4.3 out of 5 stars,36 ratings,"['Electronics', 'Computers & Accessories', 'Networking Products', 'Modem Router Combos']","['Make sure this fits\nby entering your model number.', 'The DDW36C delivers increased bandwidth: up to 686 Mbps downstream and 122 Mbps upstream', 'Works with Spectrum, Time Warner Cable, and more!', ""Enhanced Wireless Provides 8 SSIDs per radio that offer considerable flexibility for the customer's network. MSOs can reserve SSIDs for hotspots, guest access, and other applications."", 'Four 10/100/1000 Ethernet interfaces provide high-speed LAN capability. IPv4 and IPv6 support enables increased address capacity and improved security.', '1-Year Full Coverage Warranty']"
27,B00GXPTRKU,0,0,0,0,0,0
28,B00N83NMFQ,Logitech FBA_910-004161 Wireless Mouse Zany M325,Logitech,4.4 out of 5 stars,208 ratings,"['Electronics', 'Computers & Accessories', 'Computer Accessories & Peripherals', 'Keyboards, Mice & Accessories', 'Mice']","['Make sure this fits\nby entering your model number.', 'Sensing method : Logitech Advanced Optical Tracking', 'Buttons: 5 (including tilt function) : 5', 'Scroll Wheel : Yes (Web wheel )', 'Battery: 1-AA type batteries', 'Wireless system : Advanced 2.4GHz technology']"
29,B00G9EQ5PU,"GE Surge Protector Wall Tap Charging Station, 3 Outlets, 2 USB Charger Ports, 3 Prong, Power Outlet Extender, Blue LED Protected Indicator Light, 560 Joules, Warranty, UL Listed, White, 14512",GE,4.3 out of 5 stars,71 ratings,"['Electronics', 'Accessories & Supplies', 'Power Strips & Surge Protectors', 'Surge Protectors']","['Make sure this fits\nby entering your model number.', '3 outlets and 2 USB charging ports (1.0A) with protection indicator light', 'Charge two devices with USB directly from the power source up to 20% faster with Ultra Charge', 'Auto shutdown feature for ultimate protection', '560 Joules protection rating', 'Charges smartphones, tablets, eReaders, and more']"
30,B01GWN7VQO,RBEIK Samsung Galaxy Tab A 10.1 Screen Protector (SM-T580 T585 T587 ONLY) NOT fit S Pen Version P580-9H Hardness Tempered Glass Screen Protector for Samsung Galaxy Tab A 10.1 T580 T585 t587 Tablet,RBEIK,3.2 out of 5 stars,29 ratings,"['Electronics', 'Computers & Accessories', 'Tablet Accessories', 'Screen Protectors']","['Make sure this fits\nby entering your model number.', 'Premium Tempered glass screen protector is specially designed for Samsung Galaxy Tab A 10.1 10.1-Inch Tablet (SM-T580 T585 T587 ONLY) NOT fit S Pen Version P580.', 'Perfect Anti-scratch: The surface of the Samsung Galaxy Tab A 10.1 T580 Version Tempered glass has a hardness of 9H, three times stronger than regular PET film. Even sharp objects like knives, keys and some other hard substances will not scratch it.', 'Oleophobic Coating: The glass has an oleophobic coating for an oil-resistant, anti-fingerprint, glass surface that is easy to clean.', 'High-response & high-transparency: Only 0.3mm thick + 99.99% light penetration ratio, preserves the original viewing quality and maintains the original touch experience for Samsung Galaxy Tab A 10.1.', 'Bubble-free adhesives for easy installation and no residue when removed.']"
31,B00XMV4OEC,"SVBONY Telescopes Eyepieces 1.25"" Lens 4mm Multi Coated Telescope Lens for Celestial Nebula Observations",SVBONY,4 out of 5 stars,24 ratings,"['Electronics', 'Camera & Photo', 'Accessories', 'Telescope & Microscope Accessories', 'Telescope Accessories', 'Eyepieces']","['Make sure this fits\nby entering your model number.', ""4mm high\xa0power PL eyepiece;provide high power magnification to allow you look more closely and more detailed at the moon's surface and other planet"", 'Fully coated blue film optics with all black interior design;no introduction of additional color;highly achromatic;make image more crisp and sharp', 'Wide angle and long eye-relief;more complete view and comfortable observation experience', 'Standard 1.25"" diameter with thread;fit for any 1.25"" diameter telescope and 1.25"" astronomy filters', 'Perfect for broad field lunar observations;medium-sized star clusters;wide range of cloudy nebulas\xa0and deep-sky targets']"
