,asin,product_name,product_brand,product_rating,product_rate_count,category,description
489,B01FTIGMZ4,BrightTea Mobius new 3.7V 820mAh 3.03Wh Lithium Polymer rechargeable battery Li-ion Mobius 803132 for DV 1080P camera BPI Li-Po battery,BrightTea®,3.2 out of 5 stars,11 ratings,"['Electronics', 'Camera & Photo', 'Accessories', 'Batteries & Chargers', 'Batteries', 'Camera Batteries']","['Make sure this fits\nby entering your model number.', 'Lithium Polymer rechargeable battery', '3.7V 820mAh 3.03wh', 'Mobius 803132 6A BPI Li-ion battery for DV 1080P camera', 'Battery Size: 33 mm x 31 mm x 8.0 mm（Plug Pin/hole:1.25mm-2P pitch）', 'Packager 1PCS']"
490,B00GCGGNBQ,0,0,0,0,0,0
491,B01D30WLVY,"Meade Instruments 609002 Infinity 80-90-102mm Carry Bag Telescope, Blue",Meade Instruments,4.2 out of 5 stars,46 ratings,"['Electronics', 'Camera & Photo', 'Accessories', 'Telescope & Microscope Accessories', 'Telescope Accessories']","['Make sure this fits\nby entering your model number.', 'Padded Carry Bag to hold your Infinity 80, 90, or 102 mount, tripod, optical tube, and accessories', 'Includes a shoulder strap and one hand carry strap', 'Features an accessory pouch with drawstring closure to hold all of your Meade Infinity accessories']"
492,B00ZPXVAVA,"Ritz Camera Panasonic DMC-G7KK Digital Single Lens Mirrorless Camera 14-42 mm Lens Kit 4K, Accessory Bundle, Polaroid 64GB, Polaroid 72"" Professional Tripod, Filter Set, Battery, Charger, Camera Bag and Extras,Black,Deluxe",Panasonic,4.8 out of 5 stars,31 ratings,"['Electronics', 'Camera & Photo']","['No deductibles or added costs. Parts, labor and shipping included.', ""Drops, spills and cracked screens covered from day one. Other breakdowns covered after the manufacturer's warranty expires."", 'Includes 24/7 tech support - setup, connectivity issues, troubleshooting and much more.', ""File a claim online or by phone 24/7. If we can't repair it, we'll replace it or reimburse the purchase price with an Amazon e-gift card."", 'Plans are only valid for new or certified refurbished products purchased in the last 30 days with no pre-existing damage. Protection plan documents will be delivered via email within 24 hours of purchase.']"
493,B00GWALH36,"Toshiba HI Speed Port Replicator III, Black (PA5116U-1PRP)",Toshiba,3.4 out of 5 stars,18 ratings,"['Electronics', 'Computers & Accessories', 'Laptop Accessories', 'Docking Stations']","['No deductibles or added costs. Parts, labor and shipping included.', ""Power surge covered from day one. Other breakdowns covered after the manufacturer's warranty expires."", 'Includes 24/7 tech support - setup, connectivity issues, troubleshooting and much more.', ""File a claim online or by phone 24/7. If we can't repair it, we'll replace it or reimburse the purchase price with an Amazon e-gift card."", 'Plans are only valid for new or certified refurbished products purchased in the last 30 days with no pre-existing damage. Protection plan documents will be delivered via email within 24 hours of purchase.']"
494,B00WUI45QU,"Neewer 20x28""/50x70cm Rectangular Softbox Compatible with Neewer N-250W N-300W C-250 C-300 300DI 250DI 300SDI 250SDI Studio Strobe Flash Monolight",Neewer,4.0 out of 5 stars,273 ratings,"['Electronics', 'Camera & Photo', 'Lighting & Studio', 'Lighting', 'Lighting Controls & Modifiers', 'Soft Boxes']","['Make sure this fits\nby entering your model number.', 'The softbox has been assembled and disassembled but never used', 'Filters the light to prevent shadows and reflections', 'Gives a clean professional backdrop to all items being photographed', 'Can be lit by flash, fluorescent, quartz, tungsten and flood lights', 'Removable front cover for camera lens access to the interior; Note: Softbox only, light stand and strobe light not included']"
495,B00FB1TBKS,"Ecolink Intelligent Technology Z-Wave Pet Immunity Motion Detector with Pet Immunity, White (PIRZWAVE2-ECO)",ECOLINK INTELLIGENT TECHNOLOGY,3.7 out of 5 stars,386 ratings,"['Electronics', 'Security & Surveillance', 'Motion Detectors']","['Make sure this fits\nby entering your model number.', 'Premium components provide accurate and instant motion detection in both automation mode and security mode.', 'Overcomes potential interference of pets as large as 55 lbs., saving nuisance false alarms.', 'Easy installs with included flush mount and corner mount wall brackets and begins to learn as soon as batteries power it up.', 'Five year battery life and discrete design keep it out of sight and out of mind when not on alert.', 'Works with most brands of Z-wave home security hubs.']"
496,B00JF986AI,0,0,0,0,0,0
497,B00R7UKM0O,"Mini DP Adapter,CABLEDECONN 4-in-1 Mini Displayport (Thunderbolt Compatible) to HDMI/DVI/VGA HDTV with Audio Output Male to Female Converter Cable",CABLEDECONN,3.1 out of 5 stars,16 ratings,"['Electronics', 'Computers & Accessories', 'Computer Accessories & Peripherals', 'Cables & Interconnects']","['Make sure this fits\nby entering your model number.', 'Multi-fuction Mini DP Adapter with Audio output, supports HDMI/DVI/VGA output simultaneously with the max resolution of 1920x1080 to enjoy your favorite movies, YouTube clips, iTunes songs and movies.3 monitors show at the same time !Support morror display and extended dispaly', 'Light weight and portable adapter allows you to display content on your HDTV, monitor, computer, tablet, projector and other devices with HDMI & DVI & VGA to Mini DisplayPort (thunderbolt port). Note: a separated HDMI/DVI/VGA cable is required', 'Automatic detection.Easy to play .Transmit both audio and video from computer or tablet to HD display via HDMI. Support video resolutions up to 1920x1080p (Full HD) and flawless audio pass-thru. Support audio output via DVI or VGA with connecting Audio interface external speaker needed for voice', 'Support external power supply. When connect high power devices or the device is in low battery, you could connect External Power Supply via Micro B-5V power port to charge your adapter', 'Gold-plated connectors resist corrosion, provide rigidity, and improve the signal performance. Easliy display and share your videos, photos, games and more from your devices on any screen,Warranty Policy: 45 days money-back and 18-month, worry-free Guarantee']"
498,B0197VRGVI,0,0,0,0,0,0
499,B00LV84SQM,Linksys Smart Wi-Fi AC1600 Router (EA6400) (Renewed),Amazon Renewed,2.1 out of 5 stars,125 ratings,"['Electronics', 'Computers & Accessories', 'Networking Products', 'Routers']","['Make sure this fits\nby entering your model number.', 'This Certified Refurbished product is manufacturer refurbished, shows limited or no wear, and includes all original accessories plus a 90-day warranty', 'Wireless AC Technology - the Linksys EA6400 uses the next generation Wireless AC technology for powerful networking', 'Ultimate Speed - Up to 3x Faster than Wireless N - With the Linksys EA6400 Experience, speeds approximately 3x faster than Wireless N (N300 + AC1300. Beamforming Technology - Focuses wireless signal from router to the client device for optimal performance', 'USB 3.0 Port - Add external storage or other devices to share across your network. USB 3.0 transfer rate is 10x faster than USB 2.0', 'Advanced Security and Guest Access - Wireless WPA/WPA2 encryption and SPI firewall help keep your network safely connected. Easily secure your network, while providing guests with Wi-Fi access']"
500,B00IX277EE,"Opteka 85mm f/1.8 Aspherical Telephoto Portrait Lens for Nikon D5, D4s, D4, D3x, Df, D810, D800, D750, D610, D500, D7500, D7200, D7100, D5600, D5500, D5300, D5200, D3400, D3300 Digital SLR Cameras",Opteka,3.8 out of 5 stars,119 ratings,"['Electronics', 'Camera & Photo', 'Lenses', 'Camera Lenses']","['Make sure this fits\nby entering your model number.', ""INCREASE YOUR CONTROL - With a bright f/1.8 maximum aperture, you'll retain an impressive level of control over depth of field making this an ideal lens for selective focus techniques."", 'EXCELS IN LOW LIGHT SITUATIONS - This f/1.8 aperture setting allows for optimal working conditions in low light. Capture incredible photos in environments other lenses would be lost.', ""MANUAL SMOOTH FOCUS - Since this lens contains no electronics, you can refine your ability to create a perfectly smooth focus down to 2.8'."", 'STATIONARY FRONT LENS ELEMENTS- Because the front lens group does not rotate while focusing, you can easily work with polarizing, graduated ND and other rotational-dependent filter types.', ""ALL METAL DESIGN - Because Opteka has utilized only metal in the 85mm's body design, the lens is incredibly robust and produces an enhanced and accurate tactile response.""]"
501,B01G24K016,0,0,0,0,0,0
502,B01EMH1A2S,Flashpoint R2 TTL Wireless Flash Trigger Set for Nikon (Godox X1N),Flashpoint,4.5 out of 5 stars,17 ratings,"['Electronics', 'Camera & Photo', 'Lighting & Studio', 'Lighting', 'Remote Triggers']","['Make sure this fits\nby entering your model number.', 'Flashpoint R2 ETTL Transmitter for Nikon - Flashpoint R2 iTTL Receiver for Nikon - Instruction Manual - Flashpoint 1-Year USA Warranty', 'Flashpoint R2 2.4GHz Radio System unifies and simplifies', 'Great transmission range beyond 330 ft / 100m', 'Traditional Nikon Flash Modes ETTL / M / OFF', 'High Speed Sync to 1/8000th']"
503,B00MOXY9WQ,Korean Keyboard Stickers with Blue Lettering on Transparent Background for Mac / Centered Windows Keyboard,keyboardsticker,3.5 out of 5 stars,49 ratings,"['Electronics', 'Computers & Accessories', 'Computer Accessories & Peripherals', 'Keyboards, Mice & Accessories', 'Keyboards']","['Make sure this fits\nby entering your model number.', 'High-quality stickers for different keyboards Desktop, Laptop and Notebook', 'Korean Alphabet is spread onto transparent - matt sticker, with red color lettering', ""Applying possess doesn't take more than 10-15min. English letters located underneath each sticker - will accurately indicate buttons on with you will apply corresponding stickers."", 'keyboard stickers for Mac or Centered Keyboard', 'Perfect for Communication, Education, Learning a New Language, or Great Gifts!']"
504,B00V0IMLIK,Dosens Laptop Keyboard Replacement for Toshiba Satellite C650 C655 C655D C660 C675 L650 L655 L670 L675 L750 L755 Black US,Dosens,3.9 out of 5 stars,36 ratings,"['Electronics', 'Computers & Accessories', 'Computer Components', 'Laptop Replacement Parts']","['Make sure this fits\nby entering your model number.', 'Ships from Houston', '6 Months quality warranty', 'ribbon cable included', 'Please check the pictures before bidding', 'Matte finish']"
505,B01H6RE6F4,VICTONY Professional 2 in 1 Phone Lens Kit with 0.45X Super Wide Angle Lens + 12.5X Macro Lens Special 52mm Diameter Thread Lens Clip-On Cell Phone Lens Rose Gold,VICTONY,3.7 out of 5 stars,60 ratings,"['Electronics', 'Camera & Photo', 'Lenses', 'Camera Lenses']","['Make sure this fits\nby entering your model number.', 'Professional Camera Lens :The 0.45 x wide-angle largely increases your wide-angle range. Updated 12.5x Macro Lens- Designed with 52mm Diameter lens enables you to use it with 52mm UV filter, cpl and so on.', 'Professional Quality :Take better photography and capture the instant beauty on your mobile phone.It’s really convenient and will not scratch or damage your mobile device.', 'Professional Design : 2 in 1 Cell Phone Lens Kit,Wide-angle lens gives you a major wide view and the macro lens gives you a magnified picture.Anywhere you can imagine. It can be easily clipped on your jeans or hanged on your backpack.', 'Professional scope : Easy to install and remove,detachable and Portable clamps with soft rubber, guarding against bumps and scratches on your phones. clip on to all major smart phones and tablets with a single lens rear camera.mini lenses add-on for your iPhone 6/ 6s/ 6 Plus, Samsung Galaxy S6/ S6 Edge/ Note 4, iPad, smart phones and tablets, enhance your camera capability and create amazing photos.']"
506,B01AB0KL0C,Wasabi Power Extended Battery for GoPro Hero+ and Hero+ LCD,Wasabi Power,4.3 out of 5 stars,78 ratings,"['Electronics', 'Camera & Photo', 'Accessories', 'Batteries & Chargers', 'Batteries', 'Camcorder Batteries']","['Make sure this fits\nby entering your model number.', 'Seamlessly attaches to the back of your GoPro HERO+ or HERO+ LCD camera to extend battery life', 'Not Compatible with GoPro HERO', 'Provides 3.8V and 2500mAh for extended shooting; Premium Japanese cells for longer battery life with no memory effect; Displays battery level and charging status on GoPro camera', 'Fully compatible with the GoPro HERO+ and HERO+ LCD; Can be charged using any standard USB charger', 'Includes HERO+ extended battery with waterproof backdoor and USB charging cable; All items include 3-year manufacturer warranty']"
507,B00PRSY88U,Cable Clip Holder Weighted Desktop Cord Management Fixture (White),JacobsParts,4.5 out of 5 stars,137 ratings,"['Electronics', 'Accessories & Supplies', 'Cord Management']","['Make sure this fits\nby entering your model number.', 'Four slots can each hold several cords', 'Weighted base stays put on your desk', 'Use with cell phone chargers, audio cables, USB cords, power cords, and more']"
508,B00FXMDRZK,The HARRY POTTER Remote Control Wand,The Noble Collection,3.8 out of 5 stars,615 ratings,"['Electronics', 'Accessories & Supplies', 'Audio & Video Accessories', 'Remote Controls & Accessories', 'Remote Controls']","['No deductibles or added costs. Parts, labor and shipping included.', ""Power surge covered from day one. Other breakdowns covered after the manufacturer's warranty expires."", 'Includes 24/7 tech support - setup, connectivity issues, troubleshooting and much more.', ""File a claim online or by phone 24/7. If we can't repair it, we'll replace it or reimburse the purchase price with an Amazon e-gift card."", 'Plans are only valid for new or certified refurbished products purchased in the last 30 days with no pre-existing damage. Protection plan documents will be delivered via email within 24 hours of purchase.']"
509,B01AW8CQOM,0,0,0,0,0,0
510,B00V5XQCOY,"Neewer 6-In-1 Outdoor Sports Accessories Kit for GoPro HD Hero4 Black/Silver Hero 4 3 2 1, SJ4000 SJ5000, SJ6000 Sports Cameras, Includes: Head Strap Belt Mount, Chest Strap Belt Mount, Surface J-hook Buckle, Car Suction Cup Mount Holder, Floating Handle Grip, Long Screw, Wrench",Neewer,4.4 out of 5 stars,13 ratings,"['Electronics', 'Camera & Photo', 'Video', 'Camcorder Bundles']","['Make sure this fits\nby entering your model number.', 'Application 1: Floating Grip Mount + Long Screw Bolt. Floating holder is designed to keep your camera (should be with a waterproof shell, not included) easy to float on the water. Bright yellow in the water and can easily be found. Allows you to capture wonderful moments in water', 'Application 2: Head Strap + Long Screw Bolt. The adjustable head strap is compatible with all sizes Gopro Hero 4 3+ 3 2 1 Cameras. It allows you to use the Gopro camera on your head or a helmet to record those before you when skiing, riding .etc', 'Application 3: Chest Strap + Surface J-Hook Buckle + Long Screw Bolt. The Chest Harness Strap Belt and J-Hook Buckle helps your Gopro camera to have a shooting and recording steadily on the chest. Used in Parachuting bicycle riding, swimming, diving, skating and other outdoor sports', 'Application 4: Car Suction Cup Mount + Long Screw + Mount Adapter (Not included in this kit). Attach your GoPro securely to cars, dashboard or roof, boats, motorcycles and more', 'Kit Includes: 1* Car Suction Cup, 1 * Head Strap, 1 * Chest Strap, 1 * J-hook Buckle, 1 * Long Screw, 1 * Floating Mount (Yellow), 1 * Wrench']"
511,B01GZT19RM,S-Union New Laptop CPU Cooling Fan For Toshiba Satellite Radius P55W-B P55W-B5112 P55W-B5318 P55W-B5220 P55W-B5224 Series Replacement P/N:BAAA0705R5H With Thermal Grease,Generic,3.8 out of 5 stars,36 ratings,"['Electronics', 'Computers & Accessories', 'Computer Components', 'Internal Components', 'Fans & Cooling', 'CPU Cooling Fans']","['Make sure this fits\nby entering your model number.', '【Compatibility】This replacement CPU Fan is Compatible with Toshiba Satellite RadiusP55W-B P55W-B5112 P55W-B5162SM P55W-B5181SM P55W-B5201SL P55W-B5220 P55W-B5224 P55W-B5260SM P55W-B5318 P55W-B5380SM Part Number:BAAA0705R5H', '【Quality Item】All the items are TESTED carefully before shipping', '【Warranty】Comes with a 9-month worry-free warranty, if you have any pre-sales or after-sales question please feel free to contact us,we will be happy to help you', '【Shipping】SHIPPED FROM THE U.S. Delivery time takes about 2-5 business days', '【What You Get】A Brand New CPU Fan With Free a Thermal Grease']"
512,B015S0YDKE,"NETGEAR ReadyNAS RN214 4 Bay 8TB Personal Cloud NAS, Desktop & Mobile App, 24TB Capacity Network Attached Storage, 1.4GHz Quad Core Processor, 2GB RAM, RN214D42-100NES",NETGEAR,4.1 out of 5 stars,20 ratings,"['Electronics', 'Computers & Accessories', 'Data Storage', 'Network Attached Storage']","['Make sure this fits\nby entering your model number.', 'Quad core Cortex A15 1.4GHz processor with 2GB of RAM and up to 200MB/s read and 160MB/s write speeds - 2.5” or 3.5” SATA/SSD drives supported (Maximum storage of 32TB)', 'Full HD 1080p wire speed streaming and transcoding and Near-0 loss throughput anti-virus built-in', 'Dual Gigabit Ethernet - Up to 2x throughput in Link Aggregation mode and advanced BTRFS file system that delivers 5 levels of complete data protection', 'Ready CLOUD portal-based user interface and app on PC, Mac, smartphones and tablets make building a private cloud easy and secure', 'Play Plex on ReadNAS - Please visit bit.ly/ReadyNAS-Plex-Setup for setup instructions', '3 Years Warranty on Chassis']"
513,B00KQHH7VC,RF Coaxial Cable SMA Female to UHF SO239 PL259 Female RG58 3FT 90CM,MPD Digital,4.4 out of 5 stars,13 ratings,"['Electronics', 'Accessories & Supplies', 'Audio & Video Accessories', 'Cables & Interconnects', 'Power Cables']","['Make sure this fits\nby entering your model number.', 'Good for Ham radio', 'The low loss transmission line can be used in almost any application where handling characteristics, improved Shield and low loss is required', 'This pigtail alleviates much of the strain, and remains flexible', 'Fit buffing radio']"
514,B00K8ZMTFQ,"CyberPower CSP604U Professional Surge Protector, 1200J/125V, 6 Outlets, 2 USB Charge Ports, 4ft Power Cord",CyberPower,3.3 out of 5 stars,666 ratings,"['Electronics', 'Accessories & Supplies', 'Power Strips & Surge Protectors', 'Surge Protectors']","['6 NEMA 5-15R surge protected outlets provide 1200 Joules of protection for home and office computers, electronics, and home theater equipment', '(2) USB charging ports - 2.4 amp (shared). perfect for keeping tablets, smart phones, and other rechargeable electronics ready to use', 'Black - 4-foot cord with right Angle - 45 degree offset Plug', 'Green LED ""protected"" Indicator. Keyhole mounting slots for mounting on a wall, under a desk', 'CyberPower Limited lifetime warranty and $50, 000 connected equipment warranty']"
515,B00WHX1LFG,0,0,0,0,0,0
516,B01B2IQBNI,DEEPCOOL Tesseract SW Mid Tower Computer Case Blue LED Fans Side Window Standard ATX Chassis,DEEPCOOL,4.2 out of 5 stars,47 ratings,"['Electronics', 'Computers & Accessories', 'Computer Components', 'External Components', 'Computer Cases']","['Make sure this fits\nby entering your model number.', '1 x USB 3.0 + 1 x USB 2.0 Ports', '2 Blue LED fans for maximum cooling', 'Enough room for long VGA card installation', 'Support 120mm Liquid Cooler installation at rear', 'Support cable management']"
517,B00PTGXST0,0,0,0,0,0,0
518,B00VGTRQO2,HIKVISION DS-2CD2132F-I-2.8MM IR Fixed Vandal Dome Network Camera,Hikvision,4.1 out of 5 stars,105 ratings,"['Electronics', 'Camera & Photo', 'Video Surveillance', 'Surveillance Cameras', 'Dome Cameras']","['Make sure this fits\nby entering your model number.', 'English Version. ( NO Chinese Version). English color retail Box.', 'Could be updated with the firmware any time from the official Hikvision website.', '3MP (2048 x 1536) high resolution @ 15 FPS / Full HD1080p real-time video @ 30 FPS', 'IP66 Full Weatherproof rating', 'POE Capable or 12V DC (Power Supply Not included)']"
519,B00YSCPCP4,1.25inch No12 Planetary Filter for Telescopes Eyepiece (Yellow)-Enhances red and Orange Features on Jupiter and Saturn,Jinglestar,5.0 out of 5 stars,1 rating,"['Electronics', 'Camera & Photo', 'Accessories', 'Telescope & Microscope Accessories', 'Telescope Accessories', 'Filters']","['Make sure this fits\nby entering your model number.', 'Help greatly in viewing Mars by bringing out the polar ice caps, enhancing blue clouds in the atmosphere,increasing contrast, and brightening desert regions.', ""Enhances red and orange features on Jupiter and Saturn and darkens the blue festoons near Jupiter's equator"", 'The filter will fit all standard sized 1.25"" eyepieces and accessories. Can be threaded on both sides for stacking with other filters if necessary', 'Comes with sturdy plastic case-proect the eyepiece from dust and moisture', 'Mounted in a nicely anodized housing']"
520,B01DBK1GIK,"Gskyer Telescope, AZ70400 German Technology Astronomy Telescope,  Travel Refractor",Gskyer,3.8 out of 5 stars,277 ratings,"['Electronics', 'Camera & Photo', 'Binoculars & Scopes', 'Telescopes', 'Refractors']","['Make sure this fits\nby entering your model number.', '【Ultra-clear Refracting Telescope】With 400 mm focal length and 70 mm aperture to capture more clear picture and optical glass coated for enhanced image brightness to protect your eyes.', '【Optimum Magnification】Two replaceable eyepiece(16X, 40X) to enhance the power for this astronomical telescope. 5X24 finderscope with mounting bracket and cross line.', '【No-tools required】No-tools quick set up and easy find your objects, perfect telescope for kids and astronomy beginners.', '【Easy to Carry 】Our telescope comes with a backpack, you can take telescope outside easily with it. Especially for climbers, hiking, outdoor sports or just plain fun watching concerts or sports.', 'Reliable And Friendly Customer Service Come with a carry bag. Gskyer provides 12 month care to our customers. If you have any problem with this telescope after you receive it, please contact us at first time']"
521,B01682HVSC,"Acer Revo One Home Entertainment Desktop (Intel Core i5, 8GB RAM, 1TB HDD, Windows 10, RL85-UR52)",Acer,4 out of 5 stars,54 ratings,"['Electronics', 'Computers & Accessories', 'Computers & Tablets', 'Desktops', 'Towers']","['Make sure this fits\nby entering your model number.', 'Intel Core i5-5200U 2.2GHz (3MB cache)', '8GB DDR3L SDRAM Memory', '1TB 5400RPM HDD', 'Intel HD Graphics 5500', 'Windows 10']"
522,B01H5KKQUQ,BenQ ZOWIE RL2755 27 inch 1080p Gaming Monitor | 1ms 75Hz | Black Equalizer & Color Vibrance for Competitive Edge,BenQ,4.6 out of 5 stars,337 ratings,"['Electronics', 'Computers & Accessories', 'Monitors']","['No deductibles or added costs. Parts, labor and shipping included.', ""Power surge covered from day one. Other breakdowns covered after the manufacturer's warranty expires."", 'Includes 24/7 tech support - setup, connectivity issues, troubleshooting and much more.', ""File a claim online or by phone 24/7. If we can't repair it, we'll replace it or reimburse the purchase price with an Amazon e-gift card."", 'Plans are only valid for new or certified refurbished products purchased in the last 30 days with no pre-existing damage. Protection plan documents will be delivered via email within 24 hours of purchase.']"
523,B00UJ9RY5G,Golzer BANC-50 Bluetooth 4.1 Active Noise Cancelling Wireless Wired OverEar Headphones w/apt-x,Golzer,3.7 out of 5 stars,257 ratings,"['Electronics', 'Headphones', 'Over-Ear Headphones']","['No deductibles or added costs. Parts, labor and shipping included.', ""Drops, spills and cracked screens covered from day one. Other breakdowns covered after the manufacturer's warranty expires."", 'Includes 24/7 tech support - setup, connectivity issues, troubleshooting and much more.', ""File a claim online or by phone 24/7. If we can't repair it, we'll replace it or reimburse the purchase price with an Amazon e-gift card."", 'Plans are only valid for new or certified refurbished products purchased in the last 30 days with no pre-existing damage. Protection plan documents will be delivered via email within 24 hours of purchase.']"
524,B01E57CQVE,0,0,0,0,0,0
525,B00FKH6H6Y,Xscorpion USP-5465 Universal Speaker Protector Baffle - Pair,Xscorpion,3.3 out of 5 stars,32 ratings,"['Automotive', 'Replacement Parts', 'Switches & Relays', 'Relays', 'Speaker']","['Make sure this fits\nby entering your model number.', 'Pair of Universal Speaker Protector Baffles', 'Works for 5.25-inch and 6.5-inch car speakers', 'Durable ABS plastic construction', 'Creates a tight, acoustic seal behind the speaker to enhance the sound quality', 'Compresses and forms to the shape of most installations']"
526,B00M93EY94,New XRS321 Remote Control for VIZIO S3821w-c0 S3820w-c0 S2920w-c0 Vizio 2.1 and Vizio 5.1 Home Theater Sound Bar,VIZIO,4.1 out of 5 stars,186 ratings,"['Electronics', 'Accessories & Supplies', 'Audio & Video Accessories', 'Remote Controls & Accessories', 'Remote Controls']","['Make sure this fits\nby entering your model number.', 'New XRS321 sound bar remote control, work With almost all VIZIO brand SOUND BAR System .', 'Do not need any program, only put into new battery can work well!!!', 'USA Quick shipping! one year warranty!', 'Work with below knowing models:?S2120W-E0?S2120W-E0D?S2121W-D0?S2920W-C0?S3820w-C0 ?S3821w-C0?S3821w-C0B?S3821w-C0C', 'Note: If you have any query please let us know before give feedback to us, we will solve for you, thanks a lot!']"
