,asin,product_name,product_brand,product_rating,product_rate_count,category,description
721,B00GNT4A5I,"LaView 8 Channel Ultra HD 4K Home Security Camera System with 4 8MP IP Bullet Cameras, 100ft Night Vision, Weatherproof Expandable Surveillance Camera System DVR 1TB HDD",LaView,4.2 out of 5 stars,82 ratings,"['Electronics', 'Security & Surveillance', 'Surveillance Video Equipment', 'Surveillance DVR Kits']","['No deductibles or added costs. Parts, labor and shipping included.', ""Power surge covered from day one. Other breakdowns covered after the manufacturer's warranty expires."", 'Includes 24/7 tech support - setup, connectivity issues, troubleshooting and much more.', ""File a claim online or by phone 24/7. If we can't repair it, we'll replace it or reimburse the purchase price with an Amazon e-gift card."", 'Plans are only valid for new or certified refurbished products purchased in the last 30 days with no pre-existing damage. Protection plan documents will be delivered via email within 24 hours of purchase.']"
722,B00NM65VV2,0,0,0,0,0,0
723,B014ECWAN4,"HIDEit Mount for Alienware Game Console, VESA, Wall Mount, Under Desk Mount",HIDEit Mounts,4.3 out of 5 stars,22 ratings,"['Electronics', 'Accessories & Supplies', 'Audio & Video Accessories', 'TV Accessories & Parts', 'TV Ceiling & Wall Mounts']","['No deductibles or added costs. Parts, labor and shipping included.', ""Power surge covered from day one. Other breakdowns covered after the manufacturer's warranty expires."", 'Includes 24/7 tech support - setup, connectivity issues, troubleshooting and much more.', ""File a claim online or by phone 24/7. If we can't repair it, we'll replace it or reimburse the purchase price with an Amazon e-gift card."", 'Plans are only valid for new or certified refurbished products purchased in the last 30 days with no pre-existing damage. Protection plan documents will be delivered via email within 24 hours of purchase.']"
724,B00M4L4JZK,"Apple iPad Mini FD528LL/A - MD528LL/A (16GB, Wi-Fi, Black) (Renewed)",Amazon Renewed,4.2 out of 5 stars,"1,776 ratings","['Electronics', 'Computers & Accessories', 'Computers & Tablets', 'Tablets']","['No deductibles or added costs. Parts, labor and shipping included.', ""Drops, spills and cracked screens covered from day one. Other breakdowns covered after the manufacturer's warranty expires."", 'Includes 24/7 tech support - setup, connectivity issues, troubleshooting and much more.', ""File a claim online or by phone 24/7. If we can't repair it, we'll replace it or reimburse the purchase price with an Amazon e-gift card."", 'Plans are only valid for new or certified refurbished products purchased in the last 30 days with no pre-existing damage. Protection plan documents will be delivered via email within 24 hours of purchase.']"
725,B00U2WJR8M,"Foto&Tech Premium Tempered Precision Optical Glass Screen Protector Compatible with Sony A7R II, A6600 A6500 A6300 A6000 A5000 A3000 LCD+Scratch Proof 9H Hardness,HD,Anti Smudge,Rounded Edges,Slim",Foto&Tech,3.0 out of 5 stars,12 ratings,"['Electronics', 'Camera & Photo', 'Accessories', 'Digital Camera Accessories', 'Screen Protector Foils']","['Make sure this fits\nby entering your model number.', 'SCRATCH PROOF (9H Hardness) screen protection, Will not damage the LCD screen at all with the anti-crack layer', 'High Quality Japanese precision optical glass, anti glare border, six layer of protection', 'ULTRA CLEAR tempered glossy glass screen protector preserves the camera LCD viewing HD pictures', 'ROUNDED EDGES provide comfortable', 'Ultra-thin design, flip screen can easily use']"
726,B00KY4LIY4,Eastvita 8 Camera Power Splitter 1 Female & 8 Male by Eastvita,EastVita,4.3 out of 5 stars,127 ratings,"['Electronics', 'Security & Surveillance', 'Accessories', 'Surveillance Camera Cables']","['Make sure this fits\nby entering your model number.', 'Female 2.1mm Jack to 8 Male 2.1mm adapter cable.', 'For adapting power supply/cable to CCTV cameras.']"
727,B01651C94M,"Runpower Replacement Battery for Apple 13 inch MacBook Pro A1278 (Mid 2009, Mid 2010, Early 2011, Late 2011, Mid 2012) A1322[10.95V/6000mAh]",Runpower,4.4 out of 5 stars,28 ratings,"['Electronics', 'Computers & Accessories', 'Laptop Accessories', 'Batteries']","['Make sure this fits\nby entering your model number.', 'Battery type: Li-Polymer; Capacity: 65Wh/6000mAh; Cells: 6-cell; Voltage: 10.95V', ""Compatibility: Made for Apple's 13 inch MacBook Pro [A1278] versions MB990LL/A, MB991LL/A, MC374LL/A, MC375LL/A, MC700LL/A, MC724LL/A, MD314LL/A, MD313LL/A, MD101LL/A, MD102LL/A (see compatible models)."", 'Grade A cells ensure fast charges and low power consumption; Built-in circuit protection ensures both safety and stability,Worry-free, products are passed CE-/FCC-/RoHS-Certified for safety', '100% New from Manufacturer. Up to 500 recharge cycles over the life of the battery', 'Warranty: 18 months free warranty. 24 x 7 professional and efficient email support']"
728,B012F2AWMQ,Truetone CS7 1 SPOT PRO,Truetone,4.3 out of 5 stars,66 ratings,"['Electronics', 'Computers & Accessories', 'Computer Accessories & Peripherals', 'Uninterruptible Power Supply (UPS)']","['No deductibles or added costs. Parts, labor and shipping included.', ""Drops, spills and cracked screens covered from day one. Other breakdowns covered after the manufacturer's warranty expires."", 'Includes 24/7 tech support - setup, connectivity issues, troubleshooting and much more.', ""File a claim online or by phone 24/7. If we can't repair it, we'll replace it or reimburse the purchase price with an Amazon e-gift card."", 'Plans are only valid for new or certified refurbished products purchased in the last 30 days with no pre-existing damage. Protection plan documents will be delivered via email within 24 hours of purchase.']"
729,B011ITKLFU,Focal Sphear S Closed Back Headphones,Focal,3.5 out of 5 stars,219 ratings,"['Electronics', 'Headphones', 'Earbud Headphones']","['No deductibles or added costs. Parts, labor and shipping included.', ""Drops, spills and cracked screens covered from day one. Other breakdowns covered after the manufacturer's warranty expires."", 'Includes 24/7 tech support - setup, connectivity issues, troubleshooting and much more.', ""File a claim online or by phone 24/7. If we can't repair it, we'll replace it or reimburse the purchase price with an Amazon e-gift card."", 'Plans are only valid for new or certified refurbished products purchased in the last 30 days with no pre-existing damage. Protection plan documents will be delivered via email within 24 hours of purchase.']"
730,B00GTA4JQQ,"Sienoc 2.5"" to 3.5"" SSD / HDD Adapter Bracket Mounting Kit Bracket Dock Hard Drive Holder Color Black",SIENOC,4.2 out of 5 stars,70 ratings,"['Electronics', 'Computers & Accessories', 'Computer Accessories & Peripherals', 'Hard Drive Accessories']","['Make sure this fits\nby entering your model number.', 'Feather： Material:Metal 2.5"" To 3.5"" Mounting Adapter Bracket Easy to install Color: Black. Compatible SSD solid state drive and regular hard drive Compatible SATAI SATAII SATAIII', 'Package : 1 x 2.5"" to 3.5"" Bracket 8 X Screw']"
731,B01CHF7ZO4,"Bluetooth Speakers, 1STPLAYER X-Sound 30W Portable Bluetooth 4.0 Wireless Stereo HD Speaker w/Loud, Powerful Bass, USB Flash Drive Support & PowerBank Perfect for Beach, Pool, Golf & Home - Black",1ST PLAYER,4.3 out of 5 stars,34 ratings,"['Electronics', 'Portable Audio & Video', 'Portable Speakers & Docks', 'Portable Bluetooth Speakers']","['No deductibles or added costs. Parts, labor and shipping included.', ""Power surge covered from day one. Other breakdowns covered after the manufacturer's warranty expires."", 'Includes 24/7 tech support - setup, connectivity issues, troubleshooting and much more.', ""File a claim online or by phone 24/7. If we can't repair it, we'll replace it or reimburse the purchase price with an Amazon e-gift card."", 'Plans are only valid for new or certified refurbished products purchased in the last 30 days with no pre-existing damage. Protection plan documents will be delivered via email within 24 hours of purchase.']"
732,B01DUC62DI,Optoma EH416 1080p Full HD 3D DLP Business Projector,Optoma,4.4 out of 5 stars,34 ratings,"['Electronics', 'Video Projectors']","['No deductibles or added costs. Parts, labor and shipping included.', ""Power surge covered from day one. Other breakdowns covered after the manufacturer's warranty expires."", 'Includes 24/7 tech support - setup, connectivity issues, troubleshooting and much more.', ""File a claim online or by phone 24/7. If we can't repair it, we'll replace it or reimburse the purchase price with an Amazon e-gift card."", 'Plans are only valid for new or certified refurbished products purchased in the last 30 days with no pre-existing damage. Protection plan documents will be delivered via email within 24 hours of purchase.']"
733,B00RGGVG4K,"WiFi Home Camera, VSTARCAM G96 HD Wireless IP Camera with Two-Way Audio, Night Vision Indoor Camera for Pet Baby Monitor, with Cloud Service (Small)",VSTARCAM,4.0 out of 5 stars,108 ratings,"['Electronics', 'Camera & Photo', 'Video Surveillance', 'Surveillance Cameras', 'Dome Cameras']","['No deductibles or added costs. Parts, labor and shipping included.', ""Power surge covered from day one. Other breakdowns covered after the manufacturer's warranty expires."", 'Includes 24/7 tech support - setup, connectivity issues, troubleshooting and much more.', ""File a claim online or by phone 24/7. If we can't repair it, we'll replace it or reimburse the purchase price with an Amazon e-gift card."", 'Plans are only valid for new or certified refurbished products purchased in the last 30 days with no pre-existing damage. Protection plan documents will be delivered via email within 24 hours of purchase.']"
734,B00YT71BG2,"SIIG Mini-DP Video Dock with USB 3.0 LAN Hub (Black) - Mini DisplayPort to HDMI or DisplayPort, 2-port USB hub with 1 Gigabit Ethernet port for Macbooks, Surface Pros, and Dell/Asus/Lenovo/HP Laptops (JU-H30412-S1)",SIIG,3.9 out of 5 stars,92 ratings,"['Electronics', 'Computers & Accessories', 'Networking Products', 'Hubs']","['No deductibles or added costs. Parts, labor and shipping included.', ""Power surge covered from day one. Other breakdowns covered after the manufacturer's warranty expires."", 'Includes 24/7 tech support - setup, connectivity issues, troubleshooting and much more.', ""File a claim online or by phone 24/7. If we can't repair it, we'll replace it or reimburse the purchase price with an Amazon e-gift card."", 'Plans are only valid for new or certified refurbished products purchased in the last 30 days with no pre-existing damage. Protection plan documents will be delivered via email within 24 hours of purchase.']"
735,B01G2ADFL2,SanDisk 64GB Ultra UHS-I Class 10 2 Pack SDXC SD Flash Memory Card Retail SDSDUNC-064G-GN6IN - With Everything But Stromboli (tm) MicroFiber Cleaning Cloth,SanDisk,3.9 out of 5 stars,12 ratings,"['Electronics', 'Computers & Accessories', 'Computer Accessories & Peripherals']","['Your Rescue Plan documents will be delivered to you via email only to the address associated with your Amazon.com account and can be found in your account message center within the Buyer/Seller Messages', 'If your device stops working, the Rescue data recovery plan will recover the data from the failed device and return it to you on a new piece of external storage media.', 'Covers new removeable flash memory device of any brand when purchased within 30 days (receipt must be retained for purchases not on the same transaction).', 'Free shipping for in–lab data recovery; 24/7 online case status tracking', 'If your data isn’t recovered, you get your money back.']"
736,B00MIN0YWQ,DSTE Replacement for 2X BP-727 Fully Decoded Battery Compatible Canon CG-700 Vixia HF R30 R32 R40 R42 R50 R52 R60 R62 R66 R70 R72 R300 R400 R500 R700 M50 M52 M500 M506 SLR as BP-727F BP-718,DSTE,4.7 out of 5 stars,30 ratings,"['Electronics', 'Camera & Photo', 'Accessories', 'Batteries & Chargers', 'Batteries', 'Camera Batteries']","['Make sure this fits\nby entering your model number.', 'Battery Type : Li-ion', 'Battery Capacity : 10.9Wh/2950mAh', 'Output Voltage : DC 4.2V (max)/ DC 3.6V (mean)', 'Info Function for Life Indication', 'High Capacity for Stamina']"
737,B00GQPVVCY,"Compact Flash CF Card Reader, WEme Aluminum USB 3.0 Micro SD Card Converter with OTG Adapter for Extreme Pro Professional Sandisk, Lexar SDHC Memory Card and Samsung Galaxy, Mac Mini, Windows, Linux",WEme,4.1 out of 5 stars,533 ratings,"['Electronics', 'Computers & Accessories', 'Computer Accessories & Peripherals', 'Memory Card Accessories', 'Memory Card Readers']","['Make sure this fits\nby entering your model number.', ""Multi function OTG Micro B to 3 slots USB 3.0 Specification Card Reader,allow you to enjoy high data and files sync transfer rates of up to 5Gbps t so you spend less sync time (actual rates depend on your device's speed). Devices backwards compatible with USB 2.0/1.1Connects to your mobile/Tablet devices that support USB On-The-GO (USB OTG)"", 'Fast Data/Files Access and Transfer Rate Super-Speed (5Gps)/ High-Speed (480Mbps)/ Full-Speed (12 Mbps),and creates a natural extension to your latest computers and smart devices -- easily connect Windows computer(Windows XP/ Vista/ 7/ 8/ 8.1/ 10/ 32/64-bit), MAC OS8.6.9.X and later version Device.', 'USB 2.0 OTG Adapter Converter, 3*slots support the memory cards as CF type Ⅰ(3.3mm)/MD, SD/MMC, Micro SD/MD/MMC/SDHC, Support SDXC 2TB CF/SD/TF Micro/SDXC, with PowerPlug & Play and Hot swapping capability.', 'No external power supply required , USB Bus powered. Draw Power directly from USB3.0 Port.Transfer high-resolution images and video recordings to your computer faster and more efficiently', 'Stylish Design: Aluminum alloy cover with a 20cm USB data cable, easy for both laptop and PC users. To maximize the performance of your memory cards and save time when transferring files, it does not support multiple cards to use at the same time. More easily for information exchange']"
738,B00YGNUBFQ,Neewer Pro 10 Feet/3M Aluminum Alloy 3 Section Telescopic Background Support Cross Arm Crossbar(Black),Neewer,4.2 out of 5 stars,109 ratings,"['Electronics', 'Camera & Photo', 'Lighting & Studio', 'Photo Studio', 'Background Support Equipment']","['Make sure this fits\nby entering your model number.', 'Made from aluminum alloy with a professional black satin finish.', 'Folds up quickly and easily.', 'Adjustable cross bar£¬4 feet/12cm to 1feet/3cm adjustable.', '3 section telescoping bar.', 'Fit on any standard light stand 5/8"" stud.']"
739,B00IVH99KQ,"ProCase Folio Case for Galaxy Tab 4 10.1 Tablet (10 inch Galaxy Tab 4, SM-T530 / T531 / T535), with Auto Sleep/Wake Feature (Black)",ProCase,4.6 out of 5 stars,436 ratings,"['Electronics', 'Computers & Accessories', 'Tablet Accessories']","['Make sure this fits\nby entering your model number.', 'Unique designed cutouts for the Samsung Galaxy Tab 4 10.1 Tablet (SM-T530 / T531 / T535) (NOT compatible with other tablets)', 'Premium synthesized leather exterior and soft interior to prevent scratches; All corners are protected; Full access to all features (Cameras, Speaker, Ports and Buttons)', 'Support auto Sleep/Wake function when the lid is closed or opened; Magnet secures the case closure; Device can be charged with case closed', 'Built-in flip stand with multiple viewing angles; Built-in elastic hand strap, stylus pen holder; Comes with bonus stylus pen', 'Must have for the Samsung Galaxy Tab 4 10.1 owners; Search ""procase tab 4 10.1"" for other styles and color options offered by Tech Vendor']"
740,B01HGH81ZK,"Ausdom HD Webcam USB 1080P High Definition Web Camera Network Camera Auto Focusing Web Cam with Microphone for Video Calling and Recording, Desktop Computer PC Laptop Skype YouTube",AUSDOM,3.6 out of 5 stars,26 ratings,"['Electronics', 'Computers & Accessories', 'Computer Accessories & Peripherals', 'Audio & Video Accessories', 'Webcams']","['Make sure this fits\nby entering your model number.', 'In most cases, this webcam is plug and play. Some computers may need to install the webcam with the driver first, please just visit our website to download:https://www.ausdom.com/download/ (CAMERA--Webcam--AF225). After the installation, the webcam could not generate a shortcut icon in the computer, it will need some software to open the camera, such as Skype, etc.', 'Auto focus, high-resolution, foldable and easy to carry. Providing 1080P HD resolution can capture the video with the best resolution without any blurs.', 'Build-in microphone with noise reduction and recording functions. Provides LED night version lighting making first-class shots possible even in poor light.', 'Support rotating freely(up to 180°); Compatible with WindowsXP2, Windows Vista, Windows 7, Windows 8.', 'In most cases, this webcam is plug and play. Some computers may need to install the webcam with the driver first, please just visit our website to download:https://www.ausdom.com/download/ (CAMERA--Webcam--AF225).']"
741,B00IF70QCW,"[Upgraded 2019] 1byone Digital Amplified Indoor HD TV Antenna Up to 80 Miles Range, Amplifier Signal Booster Support 4K 1080P UHF VHF Freeview HDTV Channels with Coax Cable",1byone,3.8 out of 5 stars,"5,987 ratings","['Electronics', 'Accessories & Supplies', 'Audio & Video Accessories', 'Antennas', 'TV Antennas']","['No deductibles or added costs. Parts, labor and shipping included.', ""Power surge covered from day one. Other breakdowns covered after the manufacturer's warranty expires."", 'Includes 24/7 tech support - setup, connectivity issues, troubleshooting and much more.', ""File a claim online or by phone 24/7. If we can't repair it, we'll replace it or reimburse the purchase price with an Amazon e-gift card."", 'Plans are only valid for new or certified refurbished products purchased in the last 30 days with no pre-existing damage. Protection plan documents will be delivered via email within 24 hours of purchase.']"
742,B00HQ883QW,NETGEAR AC1200 Wireless WiFi Range Extender (EX6200),NETGEAR,3.9 out of 5 stars,"10,961 ratings","['Electronics', 'Computers & Accessories', 'Networking Products', 'Repeaters']","['Make sure this fits\nby entering your model number.', 'Range extenders eliminate dead zones and improves WiFi coverage in your home', 'NETGEAR extenders are easy to set up with the push of a button or mobile responsive User Interface', 'Combined speeds up to 1.2 Gbps (AC1200) for fast, reliable connections. Dual Band Extends 2.4 and 5 GHz WiFi signals from existing WiFi routers for better range, DLNA compatible Digital Media Server(DMS)', 'Universal compatibility to easily extend your current WiFi with your existing gateway, router, or ISP provided gateway', 'Connect wired devices like smart TVs and game consoles to the 5 Gigabit Ethernet Ports']"
743,B01HELU822,"External CD Drive USB 3.0 Slim External DVD CD Drive,External CD DVD +/-RW Writer/Burner/Rewriter /DVD CD ROM Drive for Apple Macbook Pro Laptop/Desktops Win10 and Win 8 By Aooking Tech",Aooking Tech,4.2 out of 5 stars,155 ratings,"['Electronics', 'Computers & Accessories', 'Computer Components', 'External Components', 'Optical Drives', 'CD & DVD Drives']","['No deductibles or added costs. Parts, labor and shipping included.', ""Power surge covered from day one. Other breakdowns covered after the manufacturer's warranty expires."", 'Includes 24/7 tech support - setup, connectivity issues, troubleshooting and much more.', ""File a claim online or by phone 24/7. If we can't repair it, we'll replace it or reimburse the purchase price with an Amazon e-gift card."", 'Plans are only valid for new or certified refurbished products purchased in the last 30 days with no pre-existing damage. Protection plan documents will be delivered via email within 24 hours of purchase.']"
744,B012BPLTOW,Cable Matters (2-Pack) Gold-Plated HDMI Keystone Jack Insert,Cable Matters,3.9 out of 5 stars,57 ratings,"['Electronics', 'Computers & Accessories', 'Computer Accessories & Peripherals', 'Computer Cable Adapters', 'Gender Changers']","['Make sure this fits\nby entering your model number.', 'COMMERCIAL GRADE HDMI Keystone Jack insert provides a professional looking installation for home theater A/V configurations with a wall mounted HDTV; Connect a Blu-ray player, streaming video player, HDTV, projector, computer or other device with the common HDMI port', 'STURDY SNAP-IN CONSTRUCTION of female to female HDMI coupler provides a secure connection; Vertically oriented keystone is compatible with a wall plate or patch panel (sold separately) with standard keystone jack blank openings', 'QUICK CONNECT INSTALLATION with reusable keystone jack inserts that can be easily disconnected and relocated when upgrading or redecorating; Connect an HDMI 90 or 270 degree angle adapter to route cables in tight spaces', 'COST-EFFECTIVE 2-PACK provides a pair of HDMI inserts for connecting a video source and an HDTV with the cables concealed behind the wall for a customized installation', 'FULL FEATURE COMPATIBILITY for all 3D, 4K, Audio Return Channel, Consumer Electronics Control, and Ethernet features of your HDMI cables and devices without any signal loss; Gold-plated HDMI pass-through connectors improve the signal transmission and resist corrosion to provide durability']"
745,B00H5ISK48,iParaAiluRy Soft Replacement Earpads Ear Pads Cushions for Logitech G35 G430 G930 F450 Headphones (1 Pair),iParaAiluRy,4.5 out of 5 stars,214 ratings,"['Electronics', 'Accessories & Supplies', 'Audio & Video Accessories', 'Headphone Accessories', 'Earpads']","['Package included 1 pair of replacement earpad', 'Compatible with Logitech G35 G930 G430 F450 headphones', 'Color: Black', 'Easy installation', 'Idea replacement if you lost or broken your ear cushions']"
746,B00KWR8Q9S,"iXCC 6-Feet 3.5mm Male to Male Universal Aux Audio Stereo Cable for Smartphones, Tablets and MP3 Player",iXCC,4.7 out of 5 stars,"1,945 ratings","['Electronics', 'Accessories & Supplies', 'Audio & Video Accessories', 'Cables & Interconnects', 'Audio Cables', 'Stereo Jack Cables']","['iXCC: Trusted by 5 million+ people for high quality innovative products.', 'Built with dual-shielding, high-quality polished metal connectors and corrosion-resistant gold-plated 3.5mm connectors. The plugs are durable enough to withstand heavy usage.', ""Seamlessly transmits stereo audio for high quality sound, while ensuring reliability and reducing signal loss and noise. The cable's flexible jack is perfect for tight spaces. It does not affect to charge your device with the charging cable."", 'The design prevents tangling (tangle free, non tangle). This makes the cable easy to store, since you can wind it without having to worry about knots or kinks. Ideally to use at home, car and outdoor.', 'Avaliable in 3 sizes: 3 ft, 6 ft and 10 ft. 2-year warranty.']"
747,B00U691Y5K,0,0,0,0,0,0
748,B019T15TJM,0,0,0,0,0,0
749,B011IK52DU,Nakedcellphone Black Hard Shell CASE Cover with Belt Clip Holster for Apple iPod Nano 7 7th 8th GEN Generation,Nakedcellphone,3.7 out of 5 stars,65 ratings,"['Electronics', 'Portable Audio & Video', 'MP3 & MP4 Player Accessories', 'Cases']","['Matte Black Color', 'Hard Polycarbonate With Powder Coat', 'Low Profile Belt Clip Keeps Your iPod Close To Your Side', 'Your iPod Is Fully Functional In Case', 'Access Headset And Charger Ports']"
750,B014DNVUG2,"TECKNET Aluminum USB External Stereo Sound Adapter for Windows and Mac, Plug and Play, No Drivers Needed",TECKNET,4.1 out of 5 stars,78 ratings,"['Electronics', 'Computers & Accessories', 'Computer Components', 'External Components', 'External Sound Cards']","['Make sure this fits\nby entering your model number.', 'Wide Application: TeckNet usb audio adapter enables USB connectivity with your existing 3.5 mm audio headphones, headset, speakers, or microphone', 'Well Performance: This pratical stereo sound adapter is ideal to bypass a faulty sound card, audio port, or as a replacement for a broken USB audio adapter.', 'Easy-to-use: No drivers required for this convenient sound card. Fully plug and play. Leave connected to a USB hub or dock to avoid unplugging', 'Wide Compatibility: Compatible with any standard USB Audio Class enabled system including Windows XP through 8.1, Linux, Mac OS X and Google Chromebook', 'Durable and Portable: This adapter is lightweight, extremely compact, and constructed of durable aluminum in a Silver finish.']"
751,B00KW6VR36,Lowpricenice Black Replacement Earpads Ear Pads Cushions Compatible For SONY MDR-RF970R MDR-RF-925Rk,Lowpricenice,3.6 out of 5 stars,192 ratings,"['Electronics', 'Accessories & Supplies', 'Audio & Video Accessories', 'Headphone Accessories', 'Earpads']","['Package contents 2 pcs replacement earpad', 'Material: (Inner) High quality foam for noise blocking enhancement;(Outer) High quality leatherette for ultra soft leather surface', 'Compatible with sony MDR-RF985R 985RK RF925RK RF970RK wireless stereo headphones', 'Product Dimensions:4 x 3.6 x 0.6 inch (10.4 x 9.4 x 1.5cm)', 'Replace your lost or worn-out ear pad cushions- cushions align with mounting posts inside the headphone ear cups, snap easily into place']"
752,B019HAV71O,Pioneer Photo Albums Photo Storage Box (Black/White Damask) (Damask Design(Bundle)),Pioneer Photo Albums,4.4 out of 5 stars,273 ratings,"['Electronics', 'Camera & Photo', 'Lighting & Studio', 'Photo Studio', 'Storage & Presentation Materials', 'Boxes']","['Damask design', 'Heavy duty storage box', 'Metal identification plate', 'Index cards included', 'Photo safe: acid free']"
