,asin,product_name,product_brand,product_rating,product_rate_count,category,description
242,B00H02O9FS,"RUBAN Plastic Hard Case and Keyboard Cover for MacBook Pro 13 inch with Retina (No USB-C)(A1502/A1425), Released 2015/2014/2013/2012 (No CD-ROM) - Black",RUBAN,4.2 out of 5 stars,54 ratings,"['Electronics', 'Computers & Accessories', 'Laptop Accessories', 'Bags, Cases & Sleeves']","['Make sure this fits\nby entering your model number.', 'The case only fits for old Macbook Pro 13"" with Retina Display NO CD ROM(A1502/A1425),Release 2015 / 2014 / 2013 / 2012.', 'Hard Plastic Case with Rubber paint over Top and Bottom Covers for Silky-smooth soft-touch. Smooth yet grippy Rubberized exterior texture.', 'Please kindly check the model number ""A1xxx"" on the back of the laptop BEFORE you purchase.', 'No cut out design, Apple Logo Shine through the case. Fully access to all buttons and features. Easy to put on and take off. Plug your charger,cable or headset without removing the case.', 'Compatible with Model: MF839LL/A, MF840LL/A, MF841LL/A, MF843LL/A(Early 2015) * MGX72LL/A, MGX82LL/A, MGX92LL/A(Mid 2014) * ME864LL/A, ME865LL/A, ME866LL/A(Late 2013) * MD212LL/A, ME662LL/A(Early 2013) * MD212LL/A, MD213LL/A(Late 2012)']"
243,B010XDS5VO,"Sangean ADP-PRD18 Switching Power AC Adapter for Models PR-D18, PR-D4W and CL-100 (Black)",Sangean,4.2 out of 5 stars,110 ratings,"['Electronics', 'Accessories & Supplies', 'Batteries, Chargers & Accessories', 'AC Adapters']","['Make sure this fits\nby entering your model number.', ""Meets the Department of Energy's (DOE) new energy saving requirements"", 'Input Voltage: AC 100-240V, 50/60Hz', 'Output Voltage: 6V, 0.4 Amps', 'For use with the PR-D18, PR-D4W and CL-100', 'UL and CUL Listed']"
244,B00YCXOWQY,Canon VIXIA HF R600 Camcorder Battery Charger (110/220v with Car & EU adapters) - Replacement Charger for Canon BP-718 and BP-727 Batteries,Synergy Digital,4.8 out of 5 stars,16 ratings,"['Electronics', 'Camera & Photo', 'Accessories', 'Batteries & Chargers', 'Battery Chargers', 'Camcorder']","['Make sure this fits\nby entering your model number.', '(110/220v with Car & EU adapters)', 'Replacement Charger for Canon BP-718 and BP-727 Batteries', 'Smart Charging LED indicator', 'Automatically turns to trickle charge after fully charged', '3 Year Limited Warranty - Synergy Digital is a Registered Trademark']"
245,B0181TSSOG,Comp Bind Technology Printer Dust Cover for Canon Pixma Pro-10 / Pro-100 Wireless Color Printer Black Nylon Anti-Static Dust Cover by Comp Bind Technology CB15-27.2''W x 15.2''D x 8.50''H,Comp Bind Technology,4.7 out of 5 stars,48 ratings,"['Electronics', 'Computers & Accessories', 'Computer Accessories & Peripherals', 'Monitor Accessories', 'Covers']","['No deductibles or added costs. Parts, labor and shipping included.', ""Power surge covered from day one. Other breakdowns covered after the manufacturer's warranty expires."", 'Includes 24/7 tech support - setup, connectivity issues, troubleshooting and much more.', ""File a claim online or by phone 24/7. If we can't repair it, we'll replace it or reimburse the purchase price with an Amazon e-gift card."", 'Plans are only valid for new or certified refurbished products purchased in the last 30 days with no pre-existing damage. Protection plan documents will be delivered via email within 24 hours of purchase.']"
246,B00VBNSXBS,Kanex USB C to VGA Adapter 8.25 Inches (21 cm)-White,Kanex,4.0 out of 5 stars,53 ratings,"['Electronics', 'Computers & Accessories', 'Computer Accessories & Peripherals', 'Computer Cable Adapters', 'USB-to-VGA Adapters']","['Make sure this fits\nby entering your model number.', 'The Kanex USB-C to VGA Adapter lets you expand your new MacBook’s screen onto a VGA supported display, computer monitor or projector. It’s the perfect adapter that supports sharp resolutions from your USB-C output to VGA. This adapter is designed with portability in mind.', 'Display your presentations on any VGA equipped display with our USB-C to VGA Adapter. Many projectors and displays continue to utilize the VGA interface. It’s a simple plug and play solution.', 'Add a second monitor or mirror your display to increase productivity. Having that additional workspace improves multi-tasking and increases efficiency at work or at home. With the USB-C to VGA Adapter you can play video games on a larger screen, enjoy your favorite movies, TV shows, or photos in full 1080p.', 'Compatible with Mac OS X 10.10 and Above, Chrome OS 46.0.2490.82 and Above, Windows 8 & 10, MacBook 12"", Chromebook Pixel, HP Pavilion x2 - 10t Touch Laptop, HP EliteBook 840 G3 Notebook, ASUS GL752VW-DH74, Dell Latitude 11 5000 Series 2-in-1, Dell Latitude 12 7000 Series 2-in-1, and Microsoft Lumia 950/950 XL.', 'Adapter Length: 8.5” / 21CM']"
247,B00EEBS25Q,AmazonBasics Laptop Computer Backpack - Fits Up To 15 Inch Laptops,AmazonBasics,4.3 out of 5 stars,254 ratings,"['Electronics', 'Computers & Accessories', 'Laptop Accessories', 'Bags, Cases & Sleeves', 'Backpacks']","['No deductibles or added costs. Parts, labor and shipping included.', 'Stains, rips or tears and seam separation covered from day one. Other breakdowns covered after the manufacturer warranty expires.', 'File a claim online or by phone 24/7.', ""If we can't repair it, we'll replace it or reimburse the purchase price with an Amazon e-gift card."", 'Plans are only valid for new or certified refurbished products purchased in the last 30 days with no pre-existing damage. Protection plan documents will be delivered via email within 24 hours of purchase.']"
248,B01G6NZ072,"Cimostar Mini USB Desk Cooler Fan,(Metal Design, Large Air Flow, Quiet Operation), Black",Cimostar,3.0 out of 5 stars,69 ratings,"['Electronics', 'Computers & Accessories', 'Computer Accessories & Peripherals', 'USB Gadgets', 'USB Fans']","['Make sure this fits\nby entering your model number.', 'A triangle base with rubber sleeves makes the fan more stable and quiet.', '4 aluminum alloy blades provide more wind volumes than most 3 blades.', '4 Inches blade and 6 inches portable frame save your desk space.', '360 Adjustable Tilting Head', 'Lightweight / Compact Design']"
249,B00GZC35YK,0,0,0,0,0,0
250,B015ORX70S,Electop 2 Pack USB 2.0 A Female to USB B Mini 5 Pin Female Adapter Converter,Electop,3.5 out of 5 stars,20 ratings,"['Electronics', 'Computers & Accessories', 'Computer Accessories & Peripherals', 'Computer Cable Adapters', 'USB-to-USB Adapters']","['Make sure this fits\nby entering your model number.', 'USB Type A female to USB Mini B 5 pin female', 'Supports data transfer speeds up to 480 Mbps', 'Fully shielded to help reduce EMI and other interference sources', 'Plug and play, No need to install drivers, portable and flexible.', 'Product Details : Any problems, just send us vis Amazon massages, We are glad to provide you after-sale service.']"
251,B00YD5LTOY,Car Charger Car Adapter Cable 3.5mm Jack Adapto OGES542557,JinGmi,4.2 out of 5 stars,96 ratings,"['Electronics', 'Accessories & Supplies', 'Audio & Video Accessories', 'Headphone Accessories', 'Adapters']","['Multi-Function:Dual Function Audio + Charge port,let you enjoy the fun of listening to music while charging.', 'Sophisticated Design:Much compatible with for iPhone original lightning cable and headphone as the gloss white appearance, enhance the smooth feeling. Using high-tech materials imported to make sure long lasting using and fast charging. You can put it into a backpack or handbag relieved if you often go out.', 'Efficient Transmission & Stable Signal: Audio cable is built with upgraded chip to read data fast and ensure the stability and fidelity of sound transmission, giving you a fantastic music trip and experience when using this aux cord.', 'Excellent Compatibility:For iPhone, iPad and iPod touch which have a Lightening jack,SUPPORT UPGRADE IOS 11 Upgraded chip-set, making the adapter compatible with device that runs iOS 11.3 or later.', ""After Service :We provide a 12-Month Worry-free warranty.If you have any questions , please don't hesitate to contact us.This will be a great choice for sending friends a birthday or holiday gift.""]"
252,B00K3T3G9A,Rokinon RK12M-E-SIL 12mm F2.0 Ultra Wide Angle Fixed Lens for Sony E-mount (NEX) and for Other Cameras,Rokinon,4.6 out of 5 stars,101 ratings,"['Electronics', 'Camera & Photo', 'Accessories', 'Digital Camera Accessories', 'Accessory Kits']","['No deductibles or added costs. Parts, labor and shipping included.', ""Drops, spills and cracked screens covered from day one. Other breakdowns covered after the manufacturer's warranty expires."", 'Includes 24/7 tech support - setup, connectivity issues, troubleshooting and much more.', ""File a claim online or by phone 24/7. If we can't repair it, we'll replace it or reimburse the purchase price with an Amazon e-gift card."", 'Plans are only valid for new or certified refurbished products purchased in the last 30 days with no pre-existing damage. Protection plan documents will be delivered via email within 24 hours of purchase.']"
253,B00EO4WRNG,Promaster LS-CT Compact Travel Light Stand,ProMaster,5 out of 5 stars,38 ratings,"['Electronics', 'Camera & Photo', 'Lighting & Studio', 'Lighting', 'Booms & Stands']","['Make sure this fits\nby entering your model number.', ""Maximum Working Height: 75 1/2'' / 191.8 cm"", ""Minimum Working Height: 16 1/2'' / 41.9 cm Folded Height: 16'' / 40.6 cm"", 'Maximum Load: 6.6 lb / 3 kg when fully extended', 'Weight: 2 lb 10 oz / 1.19 kg', 'Universal Light Mounting Stud with 1/4-20 thread']"
254,B00KWWL8LG,ZOSI 100 Feet 30m Video Power BNC RCA Cable Wires for CCTV Security Cameras Accessories Black,ZOSI,3.7 out of 5 stars,977 ratings,"['Electronics', 'Security & Surveillance', 'Accessories', 'Surveillance Camera Cables']","['Make sure this fits\nby entering your model number.', 'All-in-one video and power cable', 'Plug and play ready. For camera with DC power only', '100 Feet video/power cables in Black', 'Video/power cable has BNC connectors and includes 2 RCA/BNC adapters', 'Bnc video & 2.1mm Power connectors']"
255,B00L6621YK,"ProCase Surface Pro 7/Pro 6/Pro 2017/ Pro 4 3/ Pro LTE Sleeve Case, 12 Inch Laptop Bag Tablet Protective Cover for Microsoft Surface Pro 2017/Pro 7 6 4 3, Compatible with Type Cover Keyboard -Red",ProCase,4.7 out of 5 stars,"2,117 ratings","['Electronics', 'Computers & Accessories', 'Tablet Accessories', 'Bags, Cases & Sleeves', 'Sleeves']","['Make sure this fits\nby entering your model number.', 'For Microsoft Surface Pro 7 / Pro 6 / Surface Pro 2017 / Pro 4 / Pro LTE / Surface PRO 3 / Surface 3 tablet computer; Compatible with Microsoft Type Cover keyboards, could be used with and without keyboards attached', 'Magnets secure the closure, keeps tablet tightly in place; Premium composition leather exterior and soft microfiber interior to prevent scratches', 'Built-in a holder for Surface Pen; Built-in large pocket for documents, smartphone and small devices', 'Slim fit, light weight; Black, Brown, and Red available']"
256,B00IVPU59W,Samsung 8GB Class 6 SDHC up to 24MB/s (MB-SS08D/AM),Samsung,4.2 out of 5 stars,48 ratings,"['Electronics', 'Computers & Accessories', 'Computer Accessories & Peripherals', 'Memory Cards', 'SD Cards']","['Make sure this fits\nby entering your model number.', 'Up to 24MB/s transfer speed', 'Great for Digital Cameras, DSLRs, Camcorders and PCs.', 'Upgrade the storage for your digital camera and camcorder devices with', 'Water proof, Temperature Proof, X-Ray proof, Magnetic proof', 'Compatible with devices with SDHC and SDxC slots.']"
257,B010AF32YU,"Aibocn Upgraded Multi-Angle Aluminum Stand for Tablets Smartphones and E-Readers Compatible with iPhone iPad Air iPod Samsung Galaxy/Tab HTC Google Nexus LG OnePlus and More, Black",Aibocn,4.4 out of 5 stars,"1,553 ratings","['Cell Phones & Accessories', 'Accessories', 'Mounts & Stands', 'Stands']","['Aibocn phone tablet stand can perfect work with 4 - 10-Inch smartphones and e-readers, you can use it to hold your phone when you watch videos. the camera is visible when used sideways.', 'Adjustable angle & Folding Stand: the back bar can be moved over 300 degrees. you can adjust it to get a comfortable angle, this holder also could be folder in small size for travel.', 'Rubber pads and feet protect your device from scratches and sliding. The insert rubber can protects thinner devices(0.4inch) but can be removed to accommodate larger ones(0.55 inch )', 'Durable aluminum body: weighs only 7.8 ounces but will bear a load of up to 12 pounds. could be used even if the device is a little heavy. dimensions: 3.9in X 3.5in X 0.8in.', 'Package Included: Multi-Angle Aluminum Stand and Our sincere customer service.']"
258,B00IMWRK60,Signstek 0.2W Portable Stereo FM Transmitter Power Long Broadcast Range,Signstek,4.1 out of 5 stars,131 ratings,"['Electronics', 'Portable Audio & Video', 'MP3 & MP4 Player Accessories', 'Bluetooth & FM Transmitters', 'FM Transmitters']","['No deductibles or added costs. Parts, labor and shipping included.', ""Power surge covered from day one. Other breakdowns covered after the manufacturer's warranty expires."", 'Includes 24/7 tech support - setup, connectivity issues, troubleshooting and much more.', ""File a claim online or by phone 24/7. If we can't repair it, we'll replace it or reimburse the purchase price with an Amazon e-gift card."", 'Plans are only valid for new or certified refurbished products purchased in the last 30 days with no pre-existing damage. Protection plan documents will be delivered via email within 24 hours of purchase.']"
259,B00RM3KXAU,"Plugable USB 2.0 OTG Micro-B to 100Mbps Fast Ethernet Adapter Compatible with Windows Tablets, Raspberry Pi Zero, and Some Android Devices (ASIX AX88772A chipset).",Plugable,4.2 out of 5 stars,370 ratings,"['Electronics', 'Computers & Accessories', 'Networking Products', 'Network Adapters', 'USB Network Adapters']","['Make sure this fits\nby entering your model number.', 'Add a fast wired network interface through the Micro-B USB OTG port on your Windows tablet and Raspberry Pi Zero. Supports Windows 10, 8.1/ 8 and Raspbian Jessie.', 'Most Windows 10 and 8.x tablets supported. Windows 10 and 8.x include a built-in device driver for this Ethernet adapter, and there is no need to install any additional driver', 'Limited Android compatibility. Android users, please confirm if your phone or tablet is compatible before purchase. You can find the latest compatibility details in the Product Information below under Technical Specification - Specification Sheet', 'Not compatible with Windows phones & Apple, Amazon, LG, phones and tablets', 'We love our Plugable products and hope you will too. All of our products are backed with a 1-year limited parts and labor warranty and Seattle-based email support']"
260,B01FJHLVOM,HUACAM HCM35N Wi-Fi Antenna Magnetic Stand Base RP SMA Connector with 3m Extension Cable,HUACAM,3.6 out of 5 stars,43 ratings,"['Electronics', 'Computers & Accessories', 'Networking Products', 'Network Antennas']","['3M RP-SMA Wi-Fi Antenna Extension Cable with Magnetic Base', 'RP-SMA (Reverse Polarity SMA) Male to Female extension cable', 'Magnetic base can be attracted on iron products', 'Ideal for extend the cable for installing the antenna to the ideal location', 'This RP-SMA connector antenna base is great for antennas with RP-SMA connector. With magnetic base you can put your antennas on any metallic surface for better signal']"
261,B00K75WB00,Dtk Laptop Notebook Computer Battery for Samsung Rv408 Rv508 Rv411 Rv415 Rv511 Rv515 Rv510 R420 R428 R430 R439 R429 R440 R505 R522 R523 R466 R462 463 R464 R465 P467 R468 R470 R478 R480,DTK,5 out of 5 stars,49 ratings,"['Electronics', 'Computers & Accessories', 'Laptop Accessories', 'Batteries']","['Make sure this fits\nby entering your model number.', 'Battery type: Li-ion; Capacity: 4400mAh; Cells: 6-cell; Voltage: 11.1V', 'R428, R429, R430, R439, R460, R462, R463, R464, R465, R466, R467, R468, R470, R478, R480, R519, R522, R530, R580, R620, R700, R710, R718, R720, R728, R780, RV411, RV420, RV510, RC410, RC420, RC510, RC520, RC530, P428, P467, Q320 Series Replacement Laptop Battery AA-PB9NC5B, AA-PB9NC6W, AA-PB9NC6B, AA-PB9NS6B, AA-PB9NS6W, AA-PL9NC2B, AA-PL9NC6B, AA-PL9NC6W', 'All DTK products are Certified by CE, FCC for safety. Strict guidelines for compatibility, and standards compliance for environment safety.', 'Grade A cells ensure fast charges and low power consumption; Built-in circuit protection ensures both safety and stability. 100% New from Manufacturer. Up to 500 recharge cycles over the life of the battery.', 'Operation time for standard batteries(6-cell, 4400mah): Around 2 hours, the actual operation time will depend on how much electricity is required by the device and how you use it. 24 x 7 email support, 12-month hassle-free warranty.']"
262,B00KAMJRU2,Smart Buy Logo 100 Pack DVD Plus R DVD+r Dl 8.5gb 8X Double Layer Blank Data Record 100 Discs Spindle,Smart Buy,4.3 out of 5 stars,61 ratings,"['Electronics', 'Accessories & Supplies', 'Blank Media', 'DVD+R Discs']","['AAA grade quality. 8.5gb/240min 8x Dvd Plus R Dvd+r Dl Dual Layer Double Layer Smartbuy Logo Top Surface (Non-printable). Can use marker write on the top surface of disc. Can label the disc.', 'Save files fast! Burning time takes about 20-25 minutes when used with 8X capable DVD Double Layer writers. Excellent compatibility with DVD writers, video players and DVD-ROM drivers. This write-once disc helps preserve videos, photos, music, emails and other files.', 'Relatively low cost per megabyte. Good for file backup before they got deleted accidentally.', 'Long-term data archiving and storage life time. Over one million readings, ensuring data protection for an extended period of time.', 'Quantity: 100 Pcs Total. Packing: CakeBox/Spindle.']"
263,B01HEQJGRU,FX Audio TUBE-01 6J1 Tube Buffer HIFI Preamplifier (Silver),FX Audio,4.1 out of 5 stars,20 ratings,"['Electronics', 'Home Audio', 'Home Theater', 'Receivers & Amplifiers', 'Preamplifiers']","['No deductibles or added costs. Parts, labor and shipping included.', ""Power surge covered from day one. Other breakdowns covered after the manufacturer's warranty expires."", 'Includes 24/7 tech support - setup, connectivity issues, troubleshooting and much more.', ""File a claim online or by phone 24/7. If we can't repair it, we'll replace it or reimburse the purchase price with an Amazon e-gift card."", 'Plans are only valid for new or certified refurbished products purchased in the last 30 days with no pre-existing damage. Protection plan documents will be delivered via email within 24 hours of purchase.']"
264,B0101S4N6W,"Canon PowerShot  G7X Mark II Video Creator Kit - w/ Manfrotto PIXI MINI Tripod, SanDisk 32GB SD Card, and extra Canon Battery Pack",Canon,4.4 out of 5 stars,339 ratings,"['Electronics', 'Camera & Photo', 'Digital Cameras', 'Point & Shoot Digital Cameras']","['No deductibles or added costs. Parts, labor and shipping included.', ""Drops, spills and cracked screens covered from day one. Other breakdowns covered after the manufacturer's warranty expires."", 'Includes 24/7 tech support - setup, connectivity issues, troubleshooting and much more.', ""File a claim online or by phone 24/7. If we can't repair it, we'll replace it or reimburse the purchase price with an Amazon e-gift card."", 'Plans are only valid for new or certified refurbished products purchased in the last 30 days with no pre-existing damage. Protection plan documents will be delivered via email within 24 hours of purchase.']"
265,B012ASD9UM,PNY Anarchy 16GB Kit (2x8GB) DDR4 2133MHz (PC4-17000) CL15 Desktop Memory (Blue) - MD16GK2D4213315AB,PNY,4.1 out of 5 stars,32 ratings,"['Electronics', 'Computers & Accessories', 'Computer Components', 'Internal Components', 'Memory']","['Make sure this fits\nby entering your model number.', 'Memory Type: DDR4', 'PC Type: Desktop', 'Frequency Speed (JEDEC): 2133MHz (PC4-17000)', 'Latency (CAS): CL15-15-15', 'Voltage: 1.2V', 'XMP Support: No', 'Speed Compatibility: Compatible with 2133MHz']"
266,B00Q489DZA,Koolertron SLR DSLR Camera Backpack USB Charge Multi-Function Waterproof Photography Bag Unisex Outdoor Travel Bag 15.6inch Laptop and Tripod for Nikon Canon Camera(Black),Koolertron,4.3 out of 5 stars,175 ratings,"['Electronics', 'Camera & Photo', 'Bags & Cases', 'Camera Cases']","['Make sure this fits\nby entering your model number.', 'Sturdy Polyester fabric, smooth zipper, the waterproof material at the bottom. Soft lining, scratch-resistant camera body. Professional shock protection, solid EVA mats, and pearl cotton to protect equipment from bumps.Built-in detachable USB plug for easy charging of mobile phones, iPad, MP3s, and other digital devices', 'Large capacity multi-pocket design: 1 front pocket,, 1main pocket, Anti-theft zipper pocket,1 laptop compartment (fits for 15.6in laptop).', 'The adjustable interior compartments allow you to design and change the internal structure of the camera bag based on your needs, and also whose cotton-padded dividers protect the fragile things like camera, lens, flash, and other photographic equipment', 'Side door design make you take out your camera quickly, while you want to shot the since of your travel, and also detachable strap in the top of the camera backpack can firmly hold the tripod.', 'Two parts for the camera backpack: Top compartment can hold the travel necessity like clothes, books, notebooks. The bottom compartment is designed for the professional DSLR digital camera (such as Canon, Nikon, Sony).remove the camera liner, can be used as a casual bag, stylish and easy to match,']"
267,B010EF9BGO,Vixen Horns Loud Industrial Electric Motor Driven Alarm/Siren (Air Raid) 120V VXS-1050AR,Vixen Horns,4.3 out of 5 stars,5 ratings,"['Electronics', 'Security & Surveillance', 'Horns & Sirens']","['Make sure this fits\nby entering your model number.', 'Color: Red', 'Type: Electric Motor', 'Voltage: 120V', 'Limited Water Resistant (IP44)', 'Metal Housing with 4-Bolt Mounting Base']"
268,B00F3ZFQK6,Signstek Electronic Auto Focus EF-NEX EF-EMOUNT FX Lens Mount Adapter for Canon EF EF-S Lens to Sony E Mount NEX 3/3N/5N/5R/7/A7 A7R Full Frame,Signstek,4.3 out of 5 stars,135 ratings,"['Electronics', 'Camera & Photo', 'Accessories', 'Lens Accessories', 'Adapters & Converters']","['No deductibles or added costs. Parts, labor and shipping included.', ""Drops, spills and cracked screens covered from day one. Other breakdowns covered after the manufacturer's warranty expires."", 'Includes 24/7 tech support - setup, connectivity issues, troubleshooting and much more.', ""File a claim online or by phone 24/7. If we can't repair it, we'll replace it or reimburse the purchase price with an Amazon e-gift card."", 'Plans are only valid for new or certified refurbished products purchased in the last 30 days with no pre-existing damage. Protection plan documents will be delivered via email within 24 hours of purchase.']"
269,B016NVZN7Y,"Projector, Mini LED Multimedia Video LCD Projector 1200lumen Max 130'' Screen for Home Theater Cinema, Movie, iPhone, Ipad, Chromecast, TV, Laptop, DVD, MHL, Gaming with HDMI USB VGA AV by Cheerlux",Cheerlux,4.4 out of 5 stars,30 ratings,"['Electronics', 'Video Projectors']","['Make sure this fits\nby entering your model number.', 'Cheerlux C6 Mini Projector is Ideal For Home Theater Cinema ,Gaming ,TV ,Backyard movie nights ,party ,and window display of Christmas and Halloween .', 'Media Interface : HDMI port(Support 1.1-1.4) ;USB2.0 port (USB2.0 support most 1080P Video and Image format ) ; TV (Analog TV or can connect with TV SET BOT through HDMI or AV input) ;Composite A/V,VGA (Connect with Laptop ,Computer) ;Headphone Jack 3.5mm', 'Compatible with more devises such as chromecast ,iphone 5s /6 6s plus/7 7s 8 plus ,ipad mini1234 pro air ,android smart phone ,laptop ,xboxone , ps1234 ,blu-ray dvd , satellite TV ,TV set box and more.', ""Easy and quick to set up ,C6 Projectors all come with Remote Control . Variable throw distances: 50''at 1.7m,72'' at 2.4m,100'' at 3.3m . C6 can play movie video music and read image pictures direct from a USB flash driver. It's Light Weight only 2.07lb and Mini Size 8.0inx6.1inx3.3in that you can take it anywhere on Travelling ."", 'Safe Product : C6 mini projector has a 75 celsius degrees temperature control switch ,it will be power off when the projector is overheat.']"
270,B00OYGGMXK,Alpine Electronics PWE-S8 Restyle Compact Powered 8-Inch Subwoofer,Alpine,4.0 out of 5 stars,127 ratings,"['Electronics', 'Car & Vehicle Electronics', 'Car Electronics', 'Car Audio', 'Subwoofers', 'Component Subwoofers']","['No deductibles or added costs. Parts, labor and shipping included.', ""Power surge covered from day one. Other breakdowns covered after the manufacturer's warranty expires."", 'Includes 24/7 tech support - setup, connectivity issues, troubleshooting and much more.', ""File a claim online or by phone 24/7. If we can't repair it, we'll replace it or reimburse the purchase price with an Amazon e-gift card."", 'Plans are only valid for new or certified refurbished products purchased in the last 30 days with no pre-existing damage. Protection plan documents will be delivered via email within 24 hours of purchase.']"
