,asin,product_name,product_brand,product_rating,product_rate_count,category,description
715,B00NV807XS,TECHTOO 9dBi Omni WiFi Antenna with RP-SMA Connector for Wireless Network Router/USB Adapter/PCI PCIe Cards/IP Camera/Wireless Range Extender(2-Pack),TECHTOO,3.9 out of 5 stars,197 ratings,"['Electronics', 'Computers & Accessories', 'Networking Products', 'Network Antennas']","['Make sure this fits\nby entering your model number.', 'Increases the range of your wireless device', 'Simply replace current antenna to increase signal strength', 'Gold Plated RP-SMA Connector( Screw-On Swivel )', '2 x 9dBi RP-SMA FEMALE (No Pole Inside Connector) Antenna for 2.4GHz For 802.11 B/G/N Frequency', 'Extend Wireless Range to Dead Spot']"
716,B012B6ZRYY,"Ematic 8-inch Windows 10, HD Quad-Core 32GB Tablet with WiFi Intel and Docking Keyboard, Black",Ematic,3.1 out of 5 stars,55 ratings,"['Electronics', 'Computers & Accessories', 'Computers & Tablets']","['Make sure this fits\nby entering your model number.', 'Windows 8.1', 'No Sim Card slot. 8” HD 1280 x 800 Display', '1.3GHz Quad-Core Intel Atom Processor', '1GB Ram', '32GB Flash Memory']"
717,B00HJ1NQLS,Sunhans Sh-2500 2500mw Wireless Signal Repeater 33dbm Wifi Signal Booster 2.5w,Sunhans,4.1 out of 5 stars,147 ratings,"['Electronics', 'Computers & Accessories', 'Networking Products', 'Repeaters']","['No deductibles or added costs. Parts, labor and shipping included.', ""Power surge covered from day one. Other breakdowns covered after the manufacturer's warranty expires."", 'Includes 24/7 tech support - setup, connectivity issues, troubleshooting and much more.', ""File a claim online or by phone 24/7. If we can't repair it, we'll replace it or reimburse the purchase price with an Amazon e-gift card."", 'Plans are only valid for new or certified refurbished products purchased in the last 30 days with no pre-existing damage. Protection plan documents will be delivered via email within 24 hours of purchase.']"
718,B01CL5HHYI,"Protective case for Ledger Nano S Cryptocurrency 2pcs, Bitcoin and Cryptocurrency Hardware Wallet Mini Protective Case, Hardware Wallets, Trezor Bitcoin Wallet, Mini Case with Strong Protection",CaseSack,4.1 out of 5 stars,14 ratings,"['Electronics', 'Computers & Accessories', 'Data Storage', 'USB Flash Drives']","['Make sure this fits\nby entering your model number.', 'Eco-friendly Hard Shell EVA Case with soft interior for gentle care for FLIR ONE Thermal Imager, Seek Compact Thermal Imager and earbuds', 'Bitcoin and Cryptocurrency Hardware Wallet Mini Protective Case for Two pieces of Ledger Nano S Cryptocurrency Hardware Wallets & one piece Trezor Bitcoin Wallet', 'Mobile Storage Case for SanDisk iXpand, iPhone iPad Lightning Flash Drive, USB Flash Drives for brands like HooToo, G-Tang,', 'Flash Drive Case for SanDisk Connect 16GB, 32GB, 64GB, 128GB, 256GB Wireless Stick Flash Drive SDWS4-', 'USB-C Hub Case applicable for Tuwejia, IOGEAR, UGREEN, Cable Matters, Plugable, Imxpw, MOKIN, nonda, Phizli']"
719,B01511D4BY,"Label KINGDOM 10-Pack Compatible with Brother P Touch Label Printer TZe-141 TZ-141 TZe141, Black on Clear, 0.7"" (18mm) x 8m (26.2ft)",Label KINGDOM,5.0 out of 5 stars,1 rating,"['Electronics', 'Accessories & Supplies', 'Office Electronics Accessories', 'Labeling Tapes']","['Make sure this fits\nby entering your model number.', '10 pack compatible with brother p touch label tape tz tze141', 'For use with p-touch: PT-1300, PT-1400, PT-1500, PT-1500PC, PT-1600, PT-1650, PT-170, PT-1700, PT-170K, PT-1750, PT-1760, PT-1800, PT-1810, PT-1830, PT-1830C, PT-1830SC, PT-1830VP, PT-1880, PT-1880C, PT-1880SC, PT-1880W, PT-18R, PT-18RKT', 'PT-1900, PT-1910, PT-1950, PT-1960, PT-2030, PT-2030AD, PT-2030VP, PT-2100, PT-2110, PT-2200, PT-2210, PT-2300, PT-2310, PT-2400, PT-2410, PT-2430PC, PT-2470, PT-2500PC, PT-2600, PT-2610, PT-2700,', 'PT-2710, PT-2730, PT-2730VP, PT-300, PT-300B, PT-310, PT-310B, PT-320, PT-330, PT-340, PT-350, PT-3600, PT-520, PT-530, PT-540, PT-550, PT-580C, PT-7500, PT-7600, PT-9200DX, PT-9200PC, PT-9400, 9500PC, PT-9600, PT-9700PC, PT-9800PCN, PT-D400, PT-D450, PT-D600, PT-E300, PT-E500, PT-E550W, PT-H300, PT-H300LI, PT-H500LI, PT-P700, PT-P750W, ST-1150, ST-1150DX, ST-5', 'Resists fading, abrasion, and damage from water, heat or cold.']"
720,B00EKJQM5E,"EVGA Supernova 1000 P2 80+ Platinum, 1000W ECO Mode Fully Modular NVIDIA SLI and Crossfire Ready 10 Year Warranty Power Supply 220-P2-1000-XR",EVGA,4.5 out of 5 stars,902 ratings,"['Electronics', 'Computers & Accessories', 'Computer Components', 'Internal Components', 'Internal Power Supplies']","['No deductibles or added costs. Parts, labor and shipping included.', ""Power surge covered from day one. Other breakdowns covered after the manufacturer's warranty expires."", 'Includes 24/7 tech support - setup, connectivity issues, troubleshooting and much more.', ""File a claim online or by phone 24/7. If we can't repair it, we'll replace it or reimburse the purchase price with an Amazon e-gift card."", 'Plans are only valid for new or certified refurbished products purchased in the last 30 days with no pre-existing damage. Protection plan documents will be delivered via email within 24 hours of purchase.']"
721,B01DNDH7FQ,DVI 24+5 to VGA High Resolution Male Monitor cable with RGB Coax - (DVI-A M to HD15 M) 10-ft,Electronics More,4.5 out of 5 stars,13 ratings,"['Electronics', 'Computers & Accessories', 'Computer Accessories & Peripherals', 'Cables & Interconnects']","['Make sure this fits\nby entering your model number.', 'High-Quality PLUG & PLAY NOTE:NO for DVI 24+1', 'Length: 10feet (3meters)', 'DVI 24+5 (DVI-I) Male Plug to VGA Male Plug', 'Dual-link DVI Plug Offers better Signal Quality and Higher Resolutions', 'Connects a VGA display (display,monitor, projector, etc.) to a DVI Video Port without an in-between']"
722,B00PUAXDXG,0,0,0,0,0,0
723,B00FW68CMA,"Mohu Antenna Sky 60 TV Antenna Outdoor Amplified 60 Mile Range Durable Lightweight Mount Kit, Certified Refurbished (MH-110533)",Amazon Renewed,3.8 out of 5 stars,80 ratings,"['Electronics', 'Accessories & Supplies', 'Audio & Video Accessories', 'Antennas', 'TV Antennas']","['ABSOLUTELY FREE HD CHANNELS: 60-mile range outdoor HDTV antenna Sky can access HD over-the-air TV channels without a cable or satellite subscription including ABC CBS NBC PBS Fox Univision and more', 'FREE HDTV FOR LIFE: The Sky 60 Antenna contains Mohu Clean Peak filter technology specially designed to AMPLIFY TV stations and filter out any RF signals that can hinder picture quality providing you with a clearer picture', '30 FT HIGH PERFORMANCE CABLE & USB ADAPTER: A completely new take on the outdoor Roof/attic HDTV antenna -- includes all mounting hardware and comes with dual powering options - USB or power cube - for flexible setup', 'RECEPTION TOTALLY DEPENDENT ON LOCATION and the type of signal being transmitted in the area (VHF/UHF). DISCLAIMER: The results of available channels in your area is an estimate based on your location and the location of the TV transmitters in your area and is not guaranteed. Every location is unique in terms of local terrain foliage and installation details which will affect your reception.', 'SATISFACTION GUARANTEED: Our customer service team of industry professionals is here to provide you with all the support you need! We are confident in the quality of our product and offer a 1-year warranty AND fantastic customer service. Email us at support@gomohu.com or call 1-855-4GOMOHU (855-446-6648) for support']"
724,B00JB1LGQQ,"Case Star ® 2 PCS(Dark Green and Purple) Earphone Handsfree Headset HARD EVA Case - Clamshell/MESH Style with Zipper Enclosure, Inner Pocket, and Durable Exterior Plus Silver Climbing Carabiner With Case Star Cell Phone Bag (EVA Earphone Case-Dark Green and Purple)",CASE STAR,4.3 out of 5 stars,42 ratings,"['Electronics', 'Accessories & Supplies', 'Audio & Video Accessories', 'Headphone Accessories', 'Cases']","['Make sure this fits\nby entering your model number.', '3 Inches in diameter - perfect size for earphones, earbuds.', 'Rigid EVA shell with braided cloth covered sides prevent scuffing and crushing.', 'Cloth lined interior to safeguard your earphones.', 'Interior pocket secures item from movement.', 'Earphones and flash memory chip are for illustration and not included.']"
725,B00N0KNT0A,DSTE Replacement for 2X BP-70A Battery + DC97 Travel and Car Charger Adapter Compatible Samsung ST95 ST100 ST6500 SL50 SL600 TL205 WB30F WB35F DV150F ES65 ES67 MV800 PL80 Camera as EA-BP70A,DSTE,4.2 out of 5 stars,63 ratings,"['Electronics', 'Camera & Photo', 'Accessories', 'Batteries & Chargers', 'Battery Chargers', 'Camera']","['Make sure this fits\nby entering your model number.', 'Battery Type: Li-ion DC 4.2V(max) DC 3.6V(mean)', 'Battery Capacity : 7.0Wh/1900mAh', 'Info Function for Life Indication', 'A 12V Car Lighter Adapter Convenient for Journey', 'Travel Charger Input: AC 100-240V 50/60Hz Output: 4.2V 0.6A']"
726,B01F4ORM7A,"[Apple MFi Certified] USB 3.0 Flash Drive for iPhone iPad, GMYLE Mini External Storage Memory Expansion USB Stick with Lightning Connector (16GB) (Gold)",GMYLE,3.7 out of 5 stars,147 ratings,"['Electronics', 'Computers & Accessories', 'Data Storage', 'USB Flash Drives']","['Make sure this fits\nby entering your model number.', 'Apple MFi certified product with lightning connector, 100% compatibility, working smoothly with iPhones, iPads, and iPod.', 'The easiest way to transfer photos and videos between iPhone, iPad, iPod, PCs and Mac Computers, free up your memory space in seconds.', 'Lightest and most compact design on the market, weighing 7g and measuring 4.8cm in length for convenient transport.', '""One-touch backup function"" allows you to back up all the contact, photos and videos from Albums in your iPhone with just one click.', 'Wide Compatibility: Support All Popular-format(Please see description for details), works with iPhone 6s, iPhone 6s Plus, iPhone 6 Plus, iPhone 6, iPhone 5s, iPhone 5c, iPhone 5, iPad Air 2, iPad Air, iPad (4th generation),iPad mini4, iPad mini 3, iPad mini2,iPad mini, iPad Pro,iPod touch (5th generation) and newer (iOS 8/9)']"
727,B00NVPMJNC,"Klipsch Reference R-112SW Subwoofer, Black",Klipsch,4.4 out of 5 stars,129 ratings,"['Electronics', 'Home Audio', 'Speakers', 'Subwoofers']","['No deductibles or added costs. Parts, labor and shipping included.', ""Power surge covered from day one. Other breakdowns covered after the manufacturer's warranty expires."", 'Includes 24/7 tech support - setup, connectivity issues, troubleshooting and much more.', ""File a claim online or by phone 24/7. If we can't repair it, we'll replace it or reimburse the purchase price with an Amazon e-gift card."", 'Plans are only valid for new or certified refurbished products purchased in the last 30 days with no pre-existing damage. Protection plan documents will be delivered via email within 24 hours of purchase.']"
728,B013UCJFSW,Grace Digital GDI-BTAR512N 100W Integrated Stereo Amplifier with Bluetooth Wireless Receiver (Black),Grace Digital,4.3 out of 5 stars,118 ratings,"['Electronics', 'Home Audio', 'Home Theater', 'Receivers & Amplifiers', 'Amplifiers']","['No deductibles or added costs. Parts, labor and shipping included.', ""Power surge covered from day one. Other breakdowns covered after the manufacturer's warranty expires."", 'Includes 24/7 tech support - setup, connectivity issues, troubleshooting and much more.', ""File a claim online or by phone 24/7. If we can't repair it, we'll replace it or reimburse the purchase price with an Amazon e-gift card."", 'Plans are only valid for new or certified refurbished products purchased in the last 30 days with no pre-existing damage. Protection plan documents will be delivered via email within 24 hours of purchase.']"
729,B00PA1VRBK,"OAproda NB-11L Micro USB Battery Charger for Canon NB-11LH Battery, PowerShot ELPH 180, ELPH 190 is, ELPH 150 is, ELPH 110 HS, ELPH 115 HS, A2300 is, A2400 is, A2500, A2600, A3500 is, A4000 is Camera",OAproda,4.3 out of 5 stars,90 ratings,"['Electronics', 'Camera & Photo', 'Accessories', 'Batteries & Chargers', 'Battery Chargers', 'Camera']","['Make sure this fits\nby entering your model number.', 'OAproda canon nb11l usb faster charger is ultra-thin, lightweight, space-saving with only 0.71 inch thickness. Patented with CE, FCC Certification, can be charged fastly and safely.', 'Micro USB Canon Camera Battery Charger is Fully Compatible with Canon NB-11L,NB-11LH Original Battery and Rechargeable Battery.', 'Micro Input: 5V, 1A, Output: 4.2V, 500mA. All Items Include A 3-year Manufacturer Warranty.', 'Versatile Charging Options: by Portable Power Source, Power Bank / Battery, USB Wall Charger, USB Car Charger. This NB-11L Charger is great for travel, business trip and other outdoor/indoor activities.', 'For Security, Do NOT Charge your Battery / Charger with Computer, in order to Avoid any possible Damages of Computer from High Temperature.']"
730,B00E2URS6S,"DE15R-6 - Laptop Battery For Dell Inspiron N5010, N7010 (17R), n5030 (15R), m5030, N4010 (14R), m5010, N5110, N7110, N4110 Fits P/N : 4T7JN, TKV2V, J1KND",Laptop Battery HQ,4.1 out of 5 stars,60 ratings,"['Electronics', 'Computers & Accessories', 'Laptop Accessories', 'Batteries']","['Make sure this fits\nby entering your model number.', 'Battery type: Li-ion; Capacity: 58Wh; Cells:6-cell; Voltage: 11.1V;Capacity:5200mah.', 'High quality grade ""A"" cells. Charges quickly. Longer discharge time. Steady output and low power consumption. More than 500 times charge-discharge cycles.All products are Certified by CE, ROHS,UL1642,FCC for safety.', 'Operation time for standard batteries(6-cell, 5200mah): Around 2 hours, the actual operation time will depend on how much electricity is required by the device and how you use it. 24 x 7 email support, 12-month service.', 'Compatible Models: For Dell 15R / N5110 / N5010D-148 / N5010D-168 / N5010 / N5010D-148 / N5010D-168 / N5010D-258 / N5010D-278 / 5010-D330 / 5010-D370HK / 5010-D382 / 5010-D430 / 5010-D460HK / 5010-D480 / 5010-D481 / 5010-D520 / N5010R / N5030 / N5030D / N5030R / N5040 / N5050 17R / N7110 / N7010 / N7010R / N7010D laptop battery', '12-months hassle-free warranty service. Please check if this battery is compatible with your computer before purchasing. Part numbers of compatible batteries and Computers are listed as following.']"
731,B00XHSFYW6,Apple iPod 30 GB White (5th Generation)  (Discontinued by Manufacturer),Apple,3.6 out of 5 stars,387 ratings,"['Electronics', 'Portable Audio & Video', 'MP3 & MP4 Players']","['Stores up to 7,500 songs, 20,000 photos, or 75 hours of videos', '2.5-inch (diagonal) color LCD with LED backlight', 'Up to 14 hours of music playback, up to 3 hours of slideshows with music, up to 2 hours of video playback', 'Compatible with Mac OS X v10.3.9 or later, Windows 2000 with Service Pack 4 or later, or Windows XP Home or Professional with Service Pack 2 or later', 'Earbud-style headphones with 18-mm drivers using Neodymium transducer magnets']"
732,B00VMVE5Y8,Nikon COOLPIX P900 10x High Definition 2 Element Close-Up (Macro) Lens (67mm),Digital Nc,4.3 out of 5 stars,37 ratings,"['Electronics', 'Camera & Photo', 'Accessories', 'Lens Accessories', 'Diopters']","['No deductibles or added costs. Parts, labor and shipping included.', ""Drops, spills and cracked screens covered from day one. Other breakdowns covered after the manufacturer's warranty expires."", 'Includes 24/7 tech support - setup, connectivity issues, troubleshooting and much more.', ""File a claim online or by phone 24/7. If we can't repair it, we'll replace it or reimburse the purchase price with an Amazon e-gift card."", 'Plans are only valid for new or certified refurbished products purchased in the last 30 days with no pre-existing damage. Protection plan documents will be delivered via email within 24 hours of purchase.']"
733,B00H51E7B0,0,0,0,0,0,0
734,B017WTANCG,"New Trent iPad Keyboard Case with Detachable Wireless Bluetooth Smart Keyboard for 6th Gen (2018), iPad 5th Gen (2017), iPad Pro 9.7, iPad Air & Air 2",New Trent,3.9 out of 5 stars,459 ratings,"['Electronics', 'Computers & Accessories', 'Tablet Accessories', 'Bags, Cases & Sleeves', 'Cases']","['Make sure this fits\nby entering your model number.', 'Hard clamshell keyboard design with detachable back case', 'Optimized key design for comfortable typing experience', 'Compatible with Apple 6th iPad (2018), 5th Gen iPad (2017), iPad Pro 9.7, iPad Air, iPad Air 2', 'NOT compatible with iPad Pro 10.5, iPad Pro 12.9, iPad 4th Gen, iPad 3rd Gen, iPad 2nd Gen and iPad 1st Gen']"
735,B00HPPI0W8,"Brainwavz Headphone Case for Audio Technica ATH-M50X, Sony MDR-7506, Shure, Sennheiser, Beats, AKG, Fostex, Philips & Many Other Large Headphones",BRAINWAVZ,4.3 out of 5 stars,147 ratings,"['Electronics', 'Accessories & Supplies', 'Audio & Video Accessories', 'Headphone Accessories', 'Cases']","['Make sure this fits\nby entering your model number.', 'Large headphone case that can store most headphones.', 'Detachable internal pouch to carry additional accessories.', 'Built hard for your headphones protection.', 'Stylish red and black design with Brainwavz engineered zippers.', 'SUITABLE FOR BUT NOT LIMITED TO: Audio Technica ATH M50, ATH-M50x, ATH-M30x, MSR7NC, ATH-A900X, ATH-AD900X, ATH-900, ATH-M40x, ATH-R70x, BPSH1, ATH-M40FS, ATH-PRO700, ATH-AD700x. AKG K551, K553. Shure SRH 440, SRH-840. Takstar HI 2050, Pro 80. Ultrasone HF 580. Sony MDR-ZX770BN, MDRRF985RK, MDR-V700, V900, MDR-1A, MDR-RF6500. Fostex T50RP T50, th-x00, T40rp, 20RP MK3. Monoprice 8323']"
736,B00LLUEJFU,"UGREEN USB 3.0 Hub Ethernet Adapter 10/100/1000 Gigabit Network Converter with USB 3.0 Hub 3 Ports for Nintendo Switch, Windows Surface Pro, MacBook Air/Retina, iMac Pro, Chromebook, PC",UGREEN,4.3 out of 5 stars,243 ratings,"['Electronics', 'Computers & Accessories', 'Networking Products', 'Network Adapters', 'USB Network Adapters']","['No deductibles or added costs. Parts, labor and shipping included.', ""Power surge covered from day one. Other breakdowns covered after the manufacturer's warranty expires."", 'Includes 24/7 tech support - setup, connectivity issues, troubleshooting and much more.', ""File a claim online or by phone 24/7. If we can't repair it, we'll replace it or reimburse the purchase price with an Amazon e-gift card."", 'Plans are only valid for new or certified refurbished products purchased in the last 30 days with no pre-existing damage. Protection plan documents will be delivered via email within 24 hours of purchase.']"
737,B00F19Q3S8,GoPro Protective Lens and Covers (GoPro Official Accessory),GoPro,4.4 out of 5 stars,549 ratings,"['Electronics', 'Camera & Photo', 'Accessories', 'Digital Camera Accessories', 'Accessory Kits']","['Make sure this fits\nby entering your model number.', 'Protective Lens helps guard against dirt, dust and scratches while using your GoPro outside the housing', 'Includes lens covers for the camera and Standard Housing', 'Includes replacement battery door and side door for the camera']"
738,B00K89LBSI,Samsung Galaxy Note 3 N900 Replacement S-Pen Stylus 5 Tip Ends & Tip Removal Tweezers Tool (White),Samsung,2.9 out of 5 stars,51 ratings,"['Electronics', 'Computers & Accessories', 'Tablet Accessories', 'Styluses']","['Make sure this fits\nby entering your model number.', 'Five S Pen tips & Tweezer removal tool.', 'Replace your S Pen tips as they wear out.', 'Keep your S Pen sharp for illustrating, photo editing, or note taking.', ""You'll be able to replace tips with the included tweezers.""]"
739,B00IKDL22O,Glamorway 10Pcs TEC1-12706 Thermoelectric Cooler Heat Sink Cooling Peltier 12V 5.8A,Glamorway,4.2 out of 5 stars,73 ratings,"['Electronics', 'Computers & Accessories', 'Computer Components', 'Internal Components', 'Fans & Cooling']","['No deductibles or added costs. Parts, labor and shipping included.', ""Power surge covered from day one. Other breakdowns covered after the manufacturer's warranty expires."", 'Includes 24/7 tech support - setup, connectivity issues, troubleshooting and much more.', ""File a claim online or by phone 24/7. If we can't repair it, we'll replace it or reimburse the purchase price with an Amazon e-gift card."", 'Plans are only valid for new or certified refurbished products purchased in the last 30 days with no pre-existing damage. Protection plan documents will be delivered via email within 24 hours of purchase.']"
740,B01AG4F8ZQ,Nikon MB-D17 Multi Battery Power Pack/Grip for D500,Nikon,4.3 out of 5 stars,52 ratings,"['Electronics', 'Camera & Photo', 'Accessories', 'Digital Camera Accessories', 'Battery Grips']","['Make sure this fits\nby entering your model number.', 'MB-D17 is a Multi-Power Battery Pack for the D500', ""Supplied with: MS-D12EN Li-ion Rechargeable Battery Holder, MS-D12 AA Battery Holder, Holder Case, Contact Cap, User's Manual and Waranty"", 'MB-D17 can be powered by eight AA batteries or by a single EN-EL 15 or EN-EL 18a Lithium Ion battery', 'Features a Shutter release button and Fn button for ease in vertical shooting']"
741,B00XK61CEO,0,0,0,0,0,0
742,B00DQMJE7E,"Audioengine A2 Plus 60W Powered Desktop Speakers, Built in 24Bit DAC and Analog Amplifier (Black)",Audioengine,4.1 out of 5 stars,615 ratings,"['Electronics', 'Computers & Accessories', 'Computer Accessories & Peripherals', 'Audio & Video Accessories', 'Computer Speakers']","['No deductibles or added costs. Parts, labor and shipping included.', ""Power surge covered from day one. Other breakdowns covered after the manufacturer's warranty expires."", 'Includes 24/7 tech support - setup, connectivity issues, troubleshooting and much more.', ""File a claim online or by phone 24/7. If we can't repair it, we'll replace it or reimburse the purchase price with an Amazon e-gift card."", 'Plans are only valid for new or certified refurbished products purchased in the last 30 days with no pre-existing damage. Protection plan documents will be delivered via email within 24 hours of purchase.']"
743,B00KKS62YU,JJC EN-DK25 Eyecup for Nikon Camera D5500 D3300 D3200 D5300 D5200 D5100 replace DK25,JJC,4.8 out of 5 stars,42 ratings,"['Electronics', 'Camera & Photo', 'Accessories', 'Telescope & Microscope Accessories', 'Telescope Accessories']","['Make sure this fits\nby entering your model number.', 'JJC EN-DK25 Eyecup for Nikon Camera D3300 D3200 D5300 D5200 D5100 replace DK25', ""JJC EN-DK25 eyecup is a replacement eyepiece for select NIKON digital cameras. It allows for more comfortable viewing through the camera's viewfinder. It also decreases the amount of stray light that may enter the viewfinder and cause flare. JJC EN-DK25 eyecup is made of soft and durable silicone, so it also prevents scratching and damage to eyeglasses. It mounts easily and securely to the viewfinder and is compatible with select NIKON cameras. JJC EN-DK25 eyecup replaces NIKON DK-25 eyecup."", 'NIKON D3300, D3200, D3100, D3000 - NIKON D5300, D5200, D5100, D5000']"
744,B00LTA9PI8,0,0,0,0,0,0
745,B00MTEX2AK,"Luxebell Sport camera Accessories Kit for Gopro Hero 5 4 3+ 3 2 1, Action camera Sjcam AKASO WiMiUS Campark Lightdow DBPower VicTsing Aokon (8-in-1)",Luxebell,4.3 out of 5 stars,"1,297 ratings","['Electronics', 'Camera & Photo', 'Video', 'Camcorder Bundles']","['★Chest Mount Harness: The Chest Harness Strap and Vertical Surface J-Hook Buckle helps your Gopro camera to have a shooting and recording steadily on the chest, used it in bicycle and autocycle riding,sking boating, fishing,hiking,etc.', '★Head Strap: The adjustable head strap is compatible with all sizes GoPro cameras. It allows you to use the Gopro camera on head or helmet to record your travel.', '★Floating Handle Grip: Floating Grip is designed to keep your camera with a waterproof shell (not included)easy to float on the water. Bright yellow in the water makes it can easily be found.', '★Handheld Monopod: Adjustable ball head and thumb screw locks for multiple angle shooting with 180 degree viewing angle. NOT RECOMMENDED FOR High-impact Sports and Diving.', '★Suction Cup Mount: Provide a broad range of motion and stability; Attach your GoPro securely to Smooth Surfaces, like windshield, porcelain tile, fish tanks, other glasswares etc.']"
746,B01FF8PZA6,kuman 5 inch Resistive Touch Screen with Protective Case 800x480 HDMI TFT LCD Display Module for Raspberry Pi 3B+/3B 2 Model B RPi 1 B B+ A A+ SC5AC (5 inch Raspberry pi Display with Protection case),kuman,4.4 out of 5 stars,32 ratings,"['Electronics', 'Computers & Accessories', 'Computer Components', 'Single Board Computers']","['No deductibles or added costs. Parts, labor and shipping included.', ""Power surge covered from day one. Other breakdowns covered after the manufacturer's warranty expires."", 'Includes 24/7 tech support - setup, connectivity issues, troubleshooting and much more.', ""File a claim online or by phone 24/7. If we can't repair it, we'll replace it or reimburse the purchase price with an Amazon e-gift card."", 'Plans are only valid for new or certified refurbished products purchased in the last 30 days with no pre-existing damage. Protection plan documents will be delivered via email within 24 hours of purchase.']"
