,asin,product_name,product_brand,product_rating,product_rate_count,category,description
255,B01BYKAOXC,Logitech Illuminated Living-Room Wireless Keyboard K830 and Touchpad for Internet-Connected TVs (Renewed),Amazon Renewed,4.2 out of 5 stars,151 ratings,"['Electronics', 'Computers & Accessories', 'Computer Accessories & Peripherals', 'Keyboards, Mice & Accessories', 'Keyboards']","['No deductibles or added costs. Parts, labor and shipping included.', ""Power surge covered from day one. Other breakdowns covered after the manufacturer's warranty expires."", 'Includes 24/7 tech support - setup, connectivity issues, troubleshooting and much more.', ""File a claim online or by phone 24/7. If we can't repair it, we'll replace it or reimburse the purchase price with an Amazon e-gift card."", 'Plans are only valid for new or certified refurbished products purchased in the last 30 days with no pre-existing damage. Protection plan documents will be delivered via email within 24 hours of purchase.']"
256,B01G2SZLOS,Glarks 660-Pieces Phillips Head Computer PC Spacer Screws Assortment Kit for Hard Drive Computer Case Motherboard Fan Power Graphics (Extra: Phillips Screwdriver),Glarks,4.4 out of 5 stars,63 ratings,"['Electronics', 'Computers & Accessories', 'Computer Accessories & Peripherals', 'Cleaning & Repair', 'Computer Screws']","['Make sure this fits\nby entering your model number.', '100% Brand new high quality computer screws kit', 'Package includes: PC case, power supply, motherboard, hard drives, fan, brass standoffs mounting screws and insulation washers', 'Package quantity: 660-Pieces (Extra: 1pcs Phillips Screwdriver)', 'This pack contains the common screw inside the computer, they are suitable for PC case, power supply, motherboard, hard drives, fan and floppy/CD-ROM/DVD-ROM drives fixed installation, they are placed in a box, easy to find and use!']"
257,B00NBT28FW,"ZOSI 4 Pack 2.0MP HD 1080p 1920TVL Bullet Outdoor/Indoor Security Camera (Hybrid 4-in-1 HD-CVI/TVI/AHD/960H Analog CVBS),36PCS LEDs,100ft IR Night Vision,Weatherproof Surveillance Camera  White",ZOSI,4.2 out of 5 stars,77 ratings,"['Electronics', 'Security & Surveillance', 'Surveillance Video Equipment', 'Surveillance DVR Kits']","['No deductibles or added costs. Parts, labor and shipping included.', ""Power surge covered from day one. Other breakdowns covered after the manufacturer's warranty expires."", 'Includes 24/7 tech support - setup, connectivity issues, troubleshooting and much more.', ""File a claim online or by phone 24/7. If we can't repair it, we'll replace it or reimburse the purchase price with an Amazon e-gift card."", 'Plans are only valid for new or certified refurbished products purchased in the last 30 days with no pre-existing damage. Protection plan documents will be delivered via email within 24 hours of purchase.']"
258,B00PASBZ2E,"77mm X4 UV Filter for Camera Lenses - UV Protection Photography Filter with Lens Cloth - MRC16, Schott B270, Nano Coatings, Ultra-Slim, Weather-Sealed by Breakthrough Photography",Breakthrough Photography,4.5 out of 5 stars,147 ratings,"['Electronics', 'Camera & Photo', 'Accessories', 'Filters & Accessories', 'Skylight & UV Filters']","['Make sure this fits\nby entering your model number.', 'WORLD’S SHARPEST UV FILTER: Our X4 UV features SCHOTT Superwhite B270 optical Glass Made In Germany. Our state-of-the-art multi-resistant coating has 16-layers (MRC16) which increases light transmission to 99.4% and creates a protective layer that’s structurally harder than the glass. The moment you pick up X4 UV you’ll immediately feel the craftsmanship and quality.', 'TRACTION DESIGN: The X4 UV features an ultra-slim double-threaded 3.2mm Traction Frame which eliminates vignetting and light falloff on full-frame wide-angle setups while still working with all your lens caps. The X4 UV’s double-threaded traction frame will accept all of your filters and existing lens caps.', 'NANOTEC: In addition to state-of-the-art MRC, our optical engineers developed new nano coating layer technology, called nanotec, from the ground up to repel dirt, water and other elements by beading rather than absorbing and smearing, making it easier (and faster) than ever to clean.', 'FITMENT: This UV filter is compatible with all 77mm camera lenses. Your lens thread size will be printed underneath your lens cap or written somewhere on the lens barrel. Make sure you order the correct size otherwise it will not fit your lens.', '25 YEARS SUPPORT: We stand behind every UV filter we make with our 25 Year Ironclad Guarantee. Every X4 UV filter has a unique serial number laser engraved onto the interior frame. When you activate your 25 Year Ironclad Guarantee, we assign this serial number to you, so any future discussions on this unique filter are tracked, issues recorded and all that stuff which goes into future product design.']"
259,B00IN2DA40,Yongnuo YN-622N-TX i-TTL Wireless Flash Controller,YONGNUO,4.3 out of 5 stars,150 ratings,"['Electronics', 'Camera & Photo', 'Lighting & Studio', 'Lighting', 'Remote Triggers']","['Make sure this fits\nby entering your model number.', '1. When you prepare to upgrade YN-622N-TX first time, please download the driver and software package YN_Trigger_Updater.zip, uncompress it and run YN_Trigger_Updater_Setup.exe to install the driver/software.', '2. Download the most update firmware package and unzip it.', '3. Turn off YN-622N-TX, keep pressing mode button and turn on it again. The screen will show firmware upgrade interface . Connect the device to your PC via a USB cable.', '4. Run YN_Trigger_Updater from start menu. Click on ""Browse..."" Button and navigate to the firmware you download in step 2. Wait a few seconds until the device is detected. Click on ""Update"" to begin. When is done, YN-622N-TX will be reset automatically and you can use the new version now.', '5. If any error is encountered when updating, please turn off and try again from step 3.']"
260,B019DXKQH6,KMASHI LED Bluetooth Speaker Built-in 44 RGB Lights 4 Music Display Mode with Bass Powerful Sound Support TF Card for Party and Christmas,KMASHI,3.9 out of 5 stars,57 ratings,"['Electronics', 'Portable Audio & Video', 'Portable Speakers & Docks', 'Portable Bluetooth Speakers']","['Features: Cool and compact ""X"" design; Built-in 44 RGB LED lights, 4 music pulsating LED visual display mode best for party, home,office or anywhere; Latest Bluetooth 4.0 Technology - connect your device in 3 seconds, connection range up to 33 feet for convenient wireless freedom.', 'Powerful Functions: Volume up/down, track skip, pause, play, power on/off. Play music by 4 ways - TF card, U disk, AUX(3.5mm audio port), or pairing digital devices via Bluetooth function.', 'Excellent Sound Quality: A CSR 4.0 Bluetooth chipset, 2*3W rate power and enhanced bass resonator offer crystal clear and incredible sound quality.', 'Long Use Time: 6 to 8 hours playtime at 75% volume powered by built-in 2000mAh rechargeable Li-ion battery. For saving power, the bluetooth speaker shuts off automatically after wireless connection is discontinued for 5 minutes. Enjoy music at any time and anywhere.', 'What You Get: 1*Kmashi Colorful LED Light Bluetooth Speakers, 1*Micro USB Cable, 1*3.5mm Audio Cable, 1*User Manual, 1*VIP Card. 1-Year Warranty and Friendly Customer Service.']"
261,B00HQP9FIA,LG Electronics 16X SATA Blu-Ray Internal Rewriter with 3D Playback and M-DISC Support Optical Drive BH16NS40,LG,3.5 out of 5 stars,66 ratings,"['Electronics', 'Computers & Accessories', 'Computer Components', 'External Components', 'Optical Drives']","['No deductibles or added costs. Parts, labor and shipping included.', ""Power surge covered from day one. Other breakdowns covered after the manufacturer's warranty expires."", 'Includes 24/7 tech support - setup, connectivity issues, troubleshooting and much more.', ""File a claim online or by phone 24/7. If we can't repair it, we'll replace it or reimburse the purchase price with an Amazon e-gift card."", 'Plans are only valid for new or certified refurbished products purchased in the last 30 days with no pre-existing damage. Protection plan documents will be delivered via email within 24 hours of purchase.']"
262,B00REG9WDE,"Andoer Wide Platform Pistol Grip Camera Handle with 1/4"" Screw for SLR DSLR DC Canon Nikon Sony iPhone Xiaomi Smartphone",Andoer,4.5 out of 5 stars,172 ratings,"['Electronics', 'Camera & Photo', 'Accessories', 'Professional Video Accessories', 'Stabilizers']","['Make sure this fits\nby entering your model number.', 'The Grip Handheld Tripod System is a convenient way to shoot stable pictures with your camera or your smartphone. (Tripod Adapter not included)', 'Wide Platform holds large DSLRs as well as small Point & Shoot Cameras.', 'A rubber platform prevents slippage when the camera or your smartphone is mounted to the stage using the standard 1/4 threaded stud.', 'Equiped with 1/4 screw, suit for almost camera.', 'The new Photography and Cinema Pistol Grip is Compatible with all Apple iPhones, Samsung Note, Samsung Galaxy, Google Nexus, Nokia Lumia, HTC, Motorola, LG and many other phones and phablets.(You should have a smartphone tripod mount at first. )']"
263,B017DCXTDM,0,0,0,0,0,0
264,B012M8LXQW,"Intel Core i7 6700K 4.00 GHz Unlocked Quad Core Skylake Desktop Processor, Socket LGA 1151 [BX80662I76700K]",Intel,4.5 out of 5 stars,"1,188 ratings","['Electronics', 'Computers & Accessories', 'Computer Components', 'Internal Components', 'CPU Processors']","['No deductibles or added costs. Parts, labor and shipping included.', ""Power surge covered from day one. Other breakdowns covered after the manufacturer's warranty expires."", 'Includes 24/7 tech support - setup, connectivity issues, troubleshooting and much more.', ""File a claim online or by phone 24/7. If we can't repair it, we'll replace it or reimburse the purchase price with an Amazon e-gift card."", 'Plans are only valid for new or certified refurbished products purchased in the last 30 days with no pre-existing damage. Protection plan documents will be delivered via email within 24 hours of purchase.']"
265,B00IUQRPQS,Thermaltake TOUGHPOWER 750W 80 PLUS GOLD Semi Modular Power Supply PS-TPD-0750MPCGUS-1,Thermaltake,4.3 out of 5 stars,408 ratings,"['Electronics', 'Computers & Accessories', 'Computer Components', 'Internal Components', 'Internal Power Supplies']","['Make sure this fits\nby entering your model number.', '80 PLUS Gold Certified : Deliver up to 90% efficiency under real world load conditions to promise lowest power losses', 'Maximum Power: 750 Watts', 'Form Factor: Intel ATX 12V 2.3 & EPS 12V 2.92', 'Efficiency: 87-92% efficiency at 20-100% load', 'Power Factor Correction: Active PFC', 'Ultra Quiet 140mm Fan (2400 RPM A 10%) with intelligent fan speed control guarantees cool performance and silent operation', 'Flat Modular Cables: Not only eliminate cable clutter within the system, but takes up less space for better airflow']"
266,B00MQYWO6G,Samsung SSG-5100GB 3D HD TV Active Glasses Lot of 4 Brand New,Samsung,5 out of 5 stars,53 ratings,"['Electronics', 'Accessories & Supplies', 'Audio & Video Accessories', '3D Glasses']","['This refurbished product is tested and certified to work properly. The product will have minor blemishes and/or light scratches. The refurbishing process includes functionality testing, basic cleaning, inspection, and repackaging. The product ships with all relevant accessories, and may arrive in a generic box.']"
267,B00TKGKSVQ,"BOSS Audio Systems PT2200 Phantom 2200 Watt, 2 Channel, 2 4 Ohm Stable Class AB, Full Range, Bridgeable, Mosfet Car Amplifier with Remote Subwoofer Control",BOSS Audio Systems,2.8 out of 5 stars,12 ratings,"['Electronics', 'Car & Vehicle Electronics', 'Car Electronics', 'Car Audio', 'Amplifiers', 'Dual-Channel Speakers']","['No deductibles or added costs. Parts, labor and shipping included.', ""Power surge covered from day one. Other breakdowns covered after the manufacturer's warranty expires."", 'Includes 24/7 tech support - setup, connectivity issues, troubleshooting and much more.', ""File a claim online or by phone 24/7. If we can't repair it, we'll replace it or reimburse the purchase price with an Amazon e-gift card."", 'Plans are only valid for new or certified refurbished products purchased in the last 30 days with no pre-existing damage. Protection plan documents will be delivered via email within 24 hours of purchase.']"
268,B00IAYFDJG,Lexar Professional 1066x 128GB VPG-65 CompactFlash card (Up to 160MB/s Read) LCF128CRBNA1066,Lexar,4.1 out of 5 stars,"1,323 ratings","['Electronics', 'Computers & Accessories', 'Computer Accessories & Peripherals', 'Memory Cards', 'CompactFlash Cards']","['Your Rescue Plan documents will be delivered to you via email only to the address associated with your Amazon.com account and can be found in your account message center within the Buyer/Seller Messages', 'If your device stops working, the Rescue data recovery plan will recover the data from the failed device and return it to you on a new piece of external storage media', 'Covers new removeable flash memory device of any brand when purchased within 30 days (receipt must be retained for purchases not on the same transaction)', 'Free shipping for in–lab data recovery; 24/7 online case status tracking', 'If your data isn’t recovered, you get your money back']"
269,B00X5F50YS,"Powerextra 2 Pack Battery for Canon NB-11L, NB-11LH and Canon PowerShot A2300 IS, A2400 IS, A2500, A2600, A3400 IS, A3500 IS, A4000 IS, ELPH 110 HS, ELPH 115 HS, ELPH 130 HS, ELPH 135 IS, ELPH 140 IS",Powerextra,4.6 out of 5 stars,39 ratings,"['Electronics', 'Camera & Photo', 'Accessories', 'Batteries & Chargers', 'Batteries', 'Camera Batteries']","['Replacement Camera Li-ion Battery for Canon NB-11L', 'Voltage: 3.7 V;Capacity:1050mAh', 'Replacement Charger for Canon NB-11L Battery', 'Quick charge function and super power life,keep your Canon NB-11L', '30 days money back or 12 Months Limited Warranty.']"
270,B016AM1V8Q,Eximone AMI Audi Music Interface MDI Volkswagen Media Device Interface MMI to USB Adapter Music Cable for Audi and Volkswagen,Eximone,4 out of 5 stars,28 ratings,"['Electronics', 'Portable Audio & Video', 'MP3 & MP4 Player Accessories', 'Chargers & Power Adapters', 'Car Chargers']","['Make sure this fits\nby entering your model number.', 'Listen the music files in the USB stick via the Audi Music Interface (AMI) / Volkswagen Media Device Interface (MDI).', 'The USB port can be used as a charger for your smartphone or to read USB Flash stick for music.', 'You have to activate the AUX mode in the MMI system in order to use this product. Please note that you can only change songs from the smartphone, no control over music from the MMI system. The playlist will not be displayed on the screen.', 'Compatible con MDI, MMI 2G / 3G / 3G +.', 'This product reads the music files in the USB stick only. The music files in the smartphone cannot be read. Please buy our AMI cables with 3.5mm connector or bluetooth adapter if you want to play the music in your smartphone via the car stereo.']"
271,B00HR36OC6,SanDisk Cruzer 16GB (8GB x 2) Cruzer Blade USB 2.0 Flash Drive Jump Drive Pen Drive Sdcz50 - Two Pack,SanDisk,4.1 out of 5 stars,172 ratings,"['Electronics', 'Computers & Accessories', 'Computer Accessories & Peripherals']","['Make sure this fits\nby entering your model number.', '8GB x 2 = 16GB - take it all with you - on reliable USB Flash drives', 'Transfer with confidence - when moving images and other files from computer to computer or other Consumer electronic devices', 'Ideal for video - the easy way to store, share and play your favorite video files', 'Trust the minds behind Flash memory to keep your files safe and secure with a two-year limited** warranty', 'Compatible with Windows 7, Windows XP, Windows Vista, Mac OS 10+ and Linux; Hi-Speed USB 2.0 port required for high speed transfer']"
272,B00JZRFLEO,GoPole - Hi-Torque Thumbscrew Pack for GoPro HERO Cameras,GOPOLE,4.2 out of 5 stars,87 ratings,"['Electronics', 'Camera & Photo', 'Video']","['Make sure this fits\nby entering your model number.', 'Designed for use with all GoPro HERO Cameras', 'High Strength', 'High Visibility', 'Action Ready', 'Includes: 1x Electric Blue Thumbscrew, 1x Synergy Green Thumbscrew, 1x Transparent Thumbscrew, 3x Black Acorn Nuts']"
273,B01CHNZHQY,Timibis 6Pcs 4 Pole 3.5mm Male Repair headphone Stereo Jack Plug Metal Audio Soldering & Spring Connector Adaptor Tool,Timibis,3.9 out of 5 stars,46 ratings,"['Electronics', 'Accessories & Supplies', 'Audio & Video Accessories', 'Connectors & Adapters']","['Headphone Jack Soldering Tool, 6 Soldering Jack, 2 Heat-shrinkable tube, Stainless steel Tweezer and Rosin Core Solder.', '6Pcs 4 Pole 3.5mm Audio Jack, Color: Black, Silvery, Orange, Green, Red and Purple.', 'High quality Rosin Core Solder, perfect for headphone Jack soldering.', 'Use stainless steel tweezer while soldering to avoid burnt your fingers.', 'Come without Soldering Iron.']"
274,B00U80K2LE,808 Audio XS Wireless Bluetooth Stereo Speaker - Black,808 Audio,3.5 out of 5 stars,83 ratings,"['Electronics', 'Portable Audio & Video', 'Portable Speakers & Docks', 'Portable Bluetooth Speakers']","['Make sure this fits\nby entering your model number.', 'Control and enjoy your music wirelessly from your smartphone or tablet', 'True stereo speaker system with bass resonator', 'Single button operation', 'Play music wirelessly up to 12 hours from the built-in lithium-ion battery']"
275,B00O34AGSU,DIYmall ESP8266 ESP-01 ESP-01S WiFi Serial Transceiver Module with 1MB Flash,DIYmall,3.8 out of 5 stars,96 ratings,"['Electronics', 'Computers & Accessories', 'Networking Products', 'Network Transceivers']","['Make sure this fits\nby entering your model number.', 'The PCB layout has changed for an improvement in WiFi radio performance', '1MB Flash Memory', 'About program: Please choose ""Generic ESP8285 Module"" board in Arduino IDE to program it.', 'Document link: https://nurdspace.nl/ESP8266, video link:https://youtu.be/mS2kQVD5Sxw', 'What You Get: 1 X ESP8266 esp-01s Module.']"
276,B00YD5NCRQ,"Neoprene Camera Case: Reversible (Medium) For For Canon, Fuji, Fujifilm, Minolta, Nikon, Olympus, Panasonic, Pentax, Samsung, Sony Digital SLR Camera",HDStars,4.2 out of 5 stars,94 ratings,"['Electronics', 'Camera & Photo', 'Bags & Cases', 'Camera Cases']","['Make sure this fits\nby entering your model number.', ""Neoprene are perfect for protecting DSLR's on their own, or giving added protection while in a bag. Neoprene offers great protection to the finish and LCD Screen. Keep your valuable camera looking just like new."", 'Reversible cover // Water resistant // Self securing enclosure // Soft stretchable neoprene', 'If you are traveling and want to pack light, the Sleeve offers great protection inside a bag with alot of your other travel items.', 'You can feel safe about putting your DSLR camera in your suitcase without a large case to protect it.']"
277,B00H3A2E8G,0,0,0,0,0,0
278,B01H15NRNS,"KALIDI Casual Backpack for Women,15 Inches Laptop Classic Backpack Camping Rucksack Travel Outdoor Daypack College School Bag (Army Green)",KALIDI,4.1 out of 5 stars,110 ratings,"['Electronics', 'Computers & Accessories', 'Laptop Accessories', 'Bags, Cases & Sleeves', 'Backpacks']","['No deductibles or added costs. Parts, labor and shipping included.', 'Stains, rips or tears and seam separation covered from day one. Other breakdowns covered after the manufacturer warranty expires.', 'File a claim online or by phone 24/7.', ""If we can't repair it, we'll replace it or reimburse the purchase price with an Amazon e-gift card."", 'Plans are only valid for new or certified refurbished products purchased in the last 30 days with no pre-existing damage. Protection plan documents will be delivered via email within 24 hours of purchase.']"
279,B01BK4TUPK,"ChargerCity 360° Swivel Smartphone Tablet Mount Holder w/ 5/8"" Tripod Mic Microphone Stand Adapter for Apple iPad Pro Air Mini iPhone 11 XR XS MAX X 8 7 Plus Samsung Galaxy S9 S10 Note 9",ChargerCity,4.2 out of 5 stars,36 ratings,"['Electronics', 'Computers & Accessories', 'Tablet Accessories', 'Stands']","['No deductibles or added costs. Parts, labor and shipping included.', ""Power surge covered from day one. Other breakdowns covered after the manufacturer's warranty expires."", 'Includes 24/7 tech support - setup, connectivity issues, troubleshooting and much more.', ""File a claim online or by phone 24/7. If we can't repair it, we'll replace it or reimburse the purchase price with an Amazon e-gift card."", 'Plans are only valid for new or certified refurbished products purchased in the last 30 days with no pre-existing damage. Protection plan documents will be delivered via email within 24 hours of purchase.']"
280,B00L1FOR2K,Dell E-Port Replicator 3.0 with 130W Power Adapter E Series Latitudes (PRO3X),Dell,4.0 out of 5 stars,204 ratings,"['Electronics', 'Computers & Accessories', 'Laptop Accessories', 'Docking Stations']","['No deductibles or added costs. Parts, labor and shipping included.', ""Power surge covered from day one. Other breakdowns covered after the manufacturer's warranty expires."", 'Includes 24/7 tech support - setup, connectivity issues, troubleshooting and much more.', ""File a claim online or by phone 24/7. If we can't repair it, we'll replace it or reimburse the purchase price with an Amazon e-gift card."", 'Plans are only valid for new or certified refurbished products purchased in the last 30 days with no pre-existing damage. Protection plan documents will be delivered via email within 24 hours of purchase.']"
281,B00NEWZAWE,Canon Lens Hood LH-DC90,Canon,4.1 out of 5 stars,47 ratings,"['Electronics', 'Camera & Photo', 'Accessories', 'Lens Accessories', 'Lens Hoods']","['Make sure this fits\nby entering your model number.', 'Canon Lens Hood LH-DC90']"
282,B00GY5E13W,Sunwayfoto MAC-14 60mm Clamp Arca / Manfrotto / Bogen Compatible / Tripod Head Sunway,SUNWAYFOTO,4.6 out of 5 stars,37 ratings,"['Electronics', 'Camera & Photo', 'Accessories', 'Tripod & Monopod Accessories', 'Camera Mounts & Clamps']","['Make sure this fits\nby entering your model number.', 'SunwayFoto Arca & Manfrotto Compatible Clamp - 1/4""-20 Bushing Adapter - M6 Screw - SunwayFoto 6 Year Warranty', 'Material: Aluminum', 'Mount Thread: UNC3/8""', 'Screw: M6', 'Thickness: 21mm / 0.82""']"
283,B00H9II88C,"MPD Digital 400-n-Straight SMA-5 Times Microwave LMR-400 Coaxial Antenna Cable Line with N Male & Straight SMA Male Connectors, 5'",MPD Digital,4.0 out of 5 stars,48 ratings,"['Electronics', 'Accessories & Supplies', 'Audio & Video Accessories']","['No deductibles or added costs. Parts, labor and shipping included.', ""Power surge covered from day one. Other breakdowns covered after the manufacturer's warranty expires."", 'Includes 24/7 tech support - setup, connectivity issues, troubleshooting and much more.', ""File a claim online or by phone 24/7. If we can't repair it, we'll replace it or reimburse the purchase price with an Amazon e-gift card."", 'Plans are only valid for new or certified refurbished products purchased in the last 30 days with no pre-existing damage. Protection plan documents will be delivered via email within 24 hours of purchase.']"
284,B01GCKO96C,GoPro Handlebar/Seatpost/Pole Mount (All GoPro Cameras)  - Official GoPro Mount,GoPro,4.2 out of 5 stars,45 ratings,"['Electronics', 'Camera & Photo', 'Accessories', 'Tripod & Monopod Accessories', 'Camera Mounts & Clamps']","['Make sure this fits\nby entering your model number.', 'All-Metal Mount - Light and durable aluminum construction.', 'Unlimited Capture Options - Lets you rotate your GoPro camera 360 Degree for unlimited capture options.', 'Perfect for Mounting in Tight Spaces - Features an ultra compact footprint for mounting in tight spaces.', 'Fits Standard Handlebars + Seat posts - Secures to standard handlebars and seat posts from 22.2mm to 35mm.', 'Compatible with all GoPro cameras']"
285,B00ON7AX3U,"Linksys AC3200 Tri-Band Smart Wi-Fi Router with Gigabit and USB, Designed for Device-Heavy Homes, Smart Wi-Fi App Enabled to Control Your Network from Anywhere (EA9200)",Linksys,3.4 out of 5 stars,743 ratings,"['Electronics', 'Computers & Accessories', 'Networking Products', 'Routers']","['No deductibles or added costs. Parts, labor and shipping included.', ""Power surge covered from day one. Other breakdowns covered after the manufacturer's warranty expires."", 'Includes 24/7 tech support - setup, connectivity issues, troubleshooting and much more.', ""File a claim online or by phone 24/7. If we can't repair it, we'll replace it or reimburse the purchase price with an Amazon e-gift card."", 'Plans are only valid for new or certified refurbished products purchased in the last 30 days with no pre-existing damage. Protection plan documents will be delivered via email within 24 hours of purchase.']"
